article_id,headline,url,published_date
e9d06b2bb42bd9970de43beab2d3893534d7a619,Defense Department slams brakes on border wall as it reviews Biden order,https://www.cnn.com/2021/01/21/politics/border-wall-joe-biden-defense-department/index.html,2021-01-21 21:45:03.000 Z
e98b0d02b16794bc0884a61c4a45746cb9430630,Biden's DOJ must confront what to do with outstanding cases in which it is defending Trump. The first test could come Friday.,https://www.cnn.com/2021/01/21/politics/donald-trump-department-of-justice-joe-biden/index.html,2021-01-22 02:11:02.000 Z
05f51c586ada891448ab56d9a5c8adb2a688e2fb,"White House wants Democrats to be patient on stimulus talks as Biden pushes for bipartisan path, officials say",https://www.cnn.com/2021/01/22/politics/covid-relief-package-reconciliation/index.html,2021-01-22 21:53:55.000 Z
91333a3c6d28c9241cbb01678a97699232b79e70,The Supreme Court's run out of excuses to avoid controversial issues,https://www.cnn.com/2021/01/24/politics/supreme-court-controversial-issues/index.html,2021-01-24 18:42:26.000 Z
30170d08779c54b84170d4cb3b5cbe0462df704a,"Evidence shows Capitol rioters brutally attacked police with flagpoles, fire extinguishers and fists",https://www.cnn.com/2021/01/21/politics/capitol-rioters-attacking-police/index.html,2021-01-21 12:45:30.000 Z
e6b9756771b36dd33bce65195387b99d53ffcc2d,Four presidents take a stand,https://www.cnn.com/2021/01/24/opinions/four-presidents-take-stand-opinion-column-galant/index.html,2021-01-24 16:52:27.000 Z
0cef3367aa6268c8e796fe083761997275e22a1c,"I went to Washington for joy, and Amanda Gorman delivered it",https://www.cnn.com/2021/01/21/opinions/amanda-gorman-effect-in-washington-dc-inauguration-driver/index.html,2021-01-21 23:28:42.000 Z
312a5840a3289cd237fd6bc75faac92ed87e77e2,Syroco vs SP80: The race to create the world's fastest sail boat,https://www.cnn.com/travel/article/syroco-sp80-fastest-sailing-boat-scn/index.html,2021-01-15 11:00:04.000 Z
05eb535b9c71f386c5071345b58d66f589f0676e,Here are the 30 executive orders and actions Biden signed in his first three days,https://www.cnn.com/2021/01/22/politics/joe-biden-executive-orders-first-week/index.html,2021-01-24 16:26:47.000 Z
fa150488e7e2a6bb2cabb3ab488a677d1bece4f2,"Joe Biden grieves Covid victims on eve of his inauguration: 'To heal, we must remember'",https://www.cnn.com/2021/01/19/politics/biden-covid-victims-memorial/index.html,2021-01-20 00:04:28.000 Z
3352084a4730b09bde24db896e1b9009ded1dd43,Putin presents a Russia-sized foreign-policy headache for Biden,https://www.cnn.com/2021/01/22/europe/putin-biden-foreign-policy-intl/index.html,2021-01-22 11:05:06.000 Z
414837fd482671f85cc32524de3116f690723be8,Why Republicans are still in charge of some key Senate proceedings as Schumer and McConnell work on power-sharing,https://www.cnn.com/2021/01/22/politics/senate-power-sharing-schumer-mcconnell/index.html,2021-01-22 17:41:22.000 Z
cd032ca6fc83d0c5e46eb85995c36ed91e3726ca,Bidens quickly fire White House chief usher installed by Trump,https://www.cnn.com/2021/01/20/politics/timothy-harleth-white-house-chief-usher/index.html,2021-01-21 22:48:10.000 Z
c57113addcd31e1154942203b4dcbf473c571c26,Michelle Obama wows US presidential inauguration in head-to-toe plum and burgundy,https://www.cnn.com/style/article/michelle-obama-inauguration-outfit/index.html,2021-01-21 02:17:06.000 Z
964b98d1ed8f3a97d7338fdfbb9fa675bad3559a,"5 things to know for January 21: Inauguration, White House, Covid-19, Libya, Russia",https://www.cnn.com/2021/01/21/us/five-things-january-21-trnd/index.html,2021-01-21 11:17:57.000 Z
095bac360b2ba9671cd36949b13ed60a36edd4f2,How airbag jeans and high-tech vests could make motorbikes safer,https://www.cnn.com/2021/01/21/tech/motorcycle-airbags-spc-intl/index.html,2021-01-22 01:54:21.000 Z
d4abe064f9251e35f7cbd5580dd495e90b069565,"Arizona GOP censures Flake, Ducey and McCain, signaling a fractured party in a key swing state",https://www.cnn.com/2021/01/23/politics/arizona-gop-censure-mccain-flake-ducey/index.html,2021-01-24 14:36:07.000 Z
080de979a1e9d23569fdcbe10ab1471d11461228,Amanda Gorman calls on Americans to 'leave behind a country better than the one we were left' in powerful inauguration poem,https://www.cnn.com/2021/01/20/politics/amanda-gorman-inauguration-poem-trnd/index.html,2021-01-21 04:34:35.000 Z
efe2264ef895b655f3dda14bf6ac2d526341efe8,"Trump has left, but some of his supporters still think he's about to declare martial law -- and they're excited",https://www.cnn.com/2021/01/19/tech/martial-law-trump-conspiracy-theory/index.html,2021-01-20 15:53:40.000 Z
c8426f1ce7998dfad1fed35b1f9d201db9873385,"Pompeo attacks multiculturalism, saying it is 'not who America is'",https://www.cnn.com/2021/01/19/politics/pompeo-multiculturalism-tweet/index.html,2021-01-19 21:39:25.000 Z
2005f4dac694dfb7361f80735292289c8c23a2dd,"China builds massive Covid-19 quarantine camp for 4,000 people as outbreak continues",https://www.cnn.com/2021/01/20/asia/china-shijiazhuang-covid-quarantine-intl-hnk-scli/index.html,2021-01-21 07:22:39.000 Z
724c09b8a3cae30b7e67970abceb420e691aad14,Maya Weug becomes first female driver to earn a spot in the Ferrari Driver Academy,https://www.cnn.com/2021/01/23/motorsport/maya-weug-ferrari-driver-academy-spt-intl/index.html,2021-01-23 17:25:23.000 Z
74be7be15b2fdfdfbe11e0b7f4a7c2f0e2cf0b09,New York Mets fire general manager Jared Porter after he reportedly sent explicit pictures to female reporter,https://www.cnn.com/2021/01/19/sport/jared-porter-new-york-mets-firing-spt-intl/index.html,2021-01-19 17:29:45.000 Z
72f61304b2c61a62d2a05b4b52c60c56b2e217a1,'The White Tiger' presents a searing look at India's caste system,https://www.cnn.com/2021/01/22/entertainment/the-white-tiger-review/index.html,2021-01-22 15:03:41.000 Z
2f790fadb623c58c932e50774eccdd1db56205ef,"She was murdered for catching an Indian priest and nun in a sex act. Three decades later, justice is served",https://www.cnn.com/2021/01/23/asia/sister-abhaya-murder-intl-dst-hnk/index.html,2021-01-24 09:20:41.000 Z
889f731b80b1becc703d0f550da3fe85be9251eb,Biden's decrees vault America back onto the global stage. A whiplashed world wonders for how long,https://www.cnn.com/2021/01/24/world/us-executive-orders-foreign-policy-intl/index.html,2021-01-24 05:12:48.000 Z
7c0fe80683beee228fb7a1cd83acd8b8d711d5b6,Biden targets Trump's legacy with first-day executive actions,https://www.cnn.com/2021/01/20/politics/executive-actions-biden/index.html,2021-01-21 01:48:28.000 Z
a9283f2c8de6d9db9672c4dab1e53a22ee706d7e,Michael Douglas meets newborn grandson for the first time,https://www.cnn.com/2021/01/20/entertainment/michael-douglas-newborn-grandson-photo-trnd/index.html,2021-01-20 19:47:26.000 Z
7517041ab9d22c16549366ab2e2504f718e271c3,Pompeo's Xinjiang 'genocide' declaration presents Biden with an early China challenge,https://www.cnn.com/2021/01/22/china/us-china-xinjiang-pompeo-biden-intl-hnk/index.html,2021-01-22 05:38:20.000 Z
b401b2b006e0cfd6ecd7ded6ead2a4d7698f882f,Glad-handing Biden begins foreign diplomacy with the telephone,https://www.cnn.com/2021/01/22/politics/joe-biden-foreign-leaders/index.html,2021-01-22 21:45:57.000 Z
6893b1b144dc3bb84d949e5292cd70b44008e17a,"Rotting fish, lost business and piles of red tape. The reality of Brexit hits Britain",https://www.cnn.com/2021/01/23/business/brexit-business-intl-gbr/index.html,2021-01-23 05:00:47.000 Z
7cfd68fb0350b4b8992e5dfbf1eecf5fc03461bd,Impeachment complicates Biden's efforts to unify,https://www.cnn.com/2021/01/23/politics/joe-biden-agenda-trump-impeachment/index.html,2021-01-23 16:53:23.000 Z
381f89ca18eb0c7a0fbd44f2dff2655ee9804f53,Dinosaur fossils could belong to the world's largest ever creature,https://www.cnn.com/2021/01/19/americas/dinosaur-largest-titanosaur-intl-scli-scn/index.html,2021-01-20 00:43:34.000 Z
f1b9d9156c7064e008463fa5023d231c27d1f985,Prospects of convicting Trump erode as GOP grows vocal against Senate impeachment proceedings,https://www.cnn.com/2021/01/22/politics/senate-republicans-trump-impeachment-case/index.html,2021-01-23 02:23:01.000 Z
e2292baeb0b99a85afcf4c47c45b8348502efadd,QAnon believers are in disarray after Biden is inaugurated,https://www.cnn.com/2021/01/20/tech/qanon-believers-inauguration-reaction/index.html,2021-01-21 13:26:19.000 Z
5099f76dcecb37fd1596de23f0d298efaea3fddf,12 Army National Guard members removed from inauguration duty,https://www.cnn.com/2021/01/19/politics/national-guard-removed-inauguration-duty/index.html,2021-01-19 20:51:40.000 Z
308f90e1c4c7e89d06aa3756dd0d34b33cf3dac5,The man third in the line of presidential succession has been in five 'Batman' movies,https://www.cnn.com/2021/01/23/us/senator-patrick-leahy-batman-trnd/index.html,2021-01-23 19:00:28.000 Z
a98187406872a4e5cb91e6a2b4a7b76a1bb60264,"Biden administration to rescind Keystone pipeline permit on Wednesday, sources say",https://www.cnn.com/2021/01/19/politics/keystone-xl-pipeline-biden/index.html,2021-01-19 19:19:16.000 Z
77e2fe5aa1b34a93491af7516ae6e12fc1d37b28,Capitol rioter charged with threatening to 'assassinate' Rep. Ocasio-Cortez,https://www.cnn.com/2021/01/23/politics/garret-miller-capitol-riot-threaten-alexandria-ocasio-cortez/index.html,2021-01-23 20:25:54.000 Z
96504e0f0142c2c4334d237344ca64b62aabdacd,"Biden inheriting nonexistent coronavirus vaccine distribution plan and must start 'from scratch,' sources say",https://www.cnn.com/2021/01/21/politics/biden-covid-vaccination-trump/index.html,2021-01-21 16:37:31.000 Z
38f29c2a6ab4e5230dc34f6dd79b3e4ef62cac17,The face mask that could end the pandemic,https://www.cnn.com/2021/01/22/health/face-mask-n95-coronavirus-transmission/index.html,2021-01-23 15:24:09.000 Z
438d69f8171684bc46694a4afe17dda8fde280e0,This town powered America for decades. What do we owe them?,https://www.cnn.com/2021/01/23/opinions/biden-climate-change-gillette-wyoming-coal-sutter/index.html,2021-01-23 18:38:50.000 Z
ea31c6dfbfe707458a3196fc35c8ac9fa45ae2c2,Josh Hawley is definitely not sorry,https://www.cnn.com/2021/01/22/politics/josh-hawley-capitol-riots/index.html,2021-01-22 17:39:59.000 Z
37f38d771efe56ed22d8f782b62e7095a35c189c,Wall Street Journal: Trump pressured DOJ to file case with Supreme Court to overturn election results,https://www.cnn.com/2021/01/23/politics/trump-department-of-justice-supreme-court-election-results/index.html,2021-01-25 13:05:52.000 Z
81facfee74af979e8061df47765a301ee3a4f62d,Proud Boys leader Joseph Biggs arrested in Florida in connection with the Capitol riot,https://www.cnn.com/2021/01/20/us/proud-boys-joseph-biggs-federal-charges/index.html,2021-01-21 14:54:30.000 Z
e2a146772a5e3b892827f9b3b40c5a697d7e9893,Biden rescinds 1776 commission via executive order,https://www.cnn.com/2021/01/20/politics/biden-rescind-1776-commission-executive-order/index.html,2021-01-21 05:10:33.000 Z
97bdcb07f0d7fac7be2e550513253fe8e105ab71,Trump's acting attorney general leaves without creating controversial special counsels,https://www.cnn.com/2021/01/20/politics/justice-department-special-counsel-rosen-wilkinson/index.html,2021-01-20 15:37:17.000 Z
5884af57507649cd61b14e6f0ade034448a67043,"5 things to know for January 20: Inauguration, Covid, pardons, China, soldier arrest",https://www.cnn.com/2021/01/20/us/five-things-january-20-trnd/index.html,2021-01-20 11:13:58.000 Z
bbbcca27fd30686d2d3796a36fcb5e9c6f94ab4a,MyPillow no longer sold at Bed Bath & Beyond after CEO Mike Lindell's Capitol siege comments,https://www.cnn.com/2021/01/19/business/mypillow-bed-bath-and-beyond-sales/index.html,2021-01-19 20:58:30.000 Z
740f51d793d69cbdc681194aef32c6db6dcc244c,Trump departs Washington a pariah as his era in power ends,https://www.cnn.com/2021/01/20/politics/donald-trump-leaves-white-house/index.html,2021-01-20 15:47:31.000 Z
cd7ce84175b5181539b74e7301ce352d38bd4d21,Manhunt underway for 6 inmates who escaped from a California jail using a homemade rope,https://www.cnn.com/2021/01/11/us/california-jail-inmates-escape-trnd/index.html,2021-01-11 06:51:09.000 Z
5368871e61d34c2665104ec9f595f29c1b7ebe2a,Crystal Hefner says she almost died during cosmetic surgery,https://www.cnn.com/2021/01/07/entertainment/crystal-hefner-surgery-trnd/index.html,2021-01-07 14:34:22.000 Z
30d02b2468a05dcf75439619d85ea4568b64ad82,Two-time golf major winner Angel Cabrera arrested in Brazil,https://www.cnn.com/2021/01/15/golf/angel-cabrera-arrested-in-brazil-spt-intl/index.html,2021-01-15 18:28:20.000 Z
9f7eecaa3f6bcb2207d6878198f2e3ffbeae5800,"Harry Brant, model and son of Stephanie Seymour and Peter Brant, has died",https://www.cnn.com/2021/01/19/entertainment/harry-brant-dead/index.html,2021-01-19 17:43:46.000 Z
6ee3062b966631e90156f071d4641adec32d811f,Army vet who tended bar accused by FBI of conspiring in Capitol insurrection,https://www.cnn.com/2021/01/24/us/ohio-army-veteran-capitol-riot/index.html,2021-01-24 18:30:06.000 Z
db2c8a1cf0ab92c01b887f12aae94ecaa085861e,"Trump's last-minute pardons include Bannon, Lil Wayne and scores of others",https://www.cnn.com/2021/01/20/politics/trump-pardons-commutations-list/index.html,2021-01-20 16:22:24.000 Z
df1ba9a7b6ed05a8fa51f0d10087901a792e2588,Man who accidentally threw out a bitcoin fortune offers $70 million for permission to dig it up,https://www.cnn.com/2021/01/15/uk/bitcoin-trash-landfill-gbr-scli-intl/index.html,2021-01-15 14:59:43.000 Z
32ba91ffb801b1a4831c65cc61bbc275288abbb9,JoJo Siwa responds to board game controversy saying she 'had no idea' about the 'inappropriate' content,https://www.cnn.com/2021/01/05/us/jojo-siwa-game-trnd/index.html,2021-01-06 01:22:25.000 Z
8a36777ad4ebd6ee31e5e95c44ec860a07e91657,"'If I would have known then what I know now, I would have never stepped foot in the NFL'",https://www.cnn.com/2021/01/12/sport/nfl-cheerleader-equal-pay-raiders-bills-lawsuit-spt-intl/index.html,2021-01-17 18:34:53.000 Z
6aad7b634c2a93d03126ba46ffecdfd6df59a73e,Melania Trump outsourced writing her own 'thank you' notes to the White House residence staff,https://www.cnn.com/2021/01/20/politics/melania-trump-thank-you-notes/index.html,2021-01-20 15:23:43.000 Z
f049eb2fcc0f1869424dd135e8dd6bdcf08e513a,Body cam video shows police officer's fatal shooting of a Black man during a mental health check,https://www.cnn.com/2021/01/23/us/patrick-warren-killeen-officer-shot-kill-video/index.html,2021-01-24 09:49:18.000 Z
8820958d7cd375e1c7c387d7d6726529f22dbeb3,How much of 'Bridgerton' is forgivable?,https://www.cnn.com/2021/01/13/opinions/bridgerton-escapism-and-jane-austen-fantasies-maltby/index.html,2021-01-13 17:53:01.000 Z
20699bd1f6dbe29c142e4fafba8e37c3145da027,"Bitter, Trump skips chance to say splashy, high-profile farewell",https://www.cnn.com/2021/01/19/politics/trump-leaving-white-house-farewell-address/index.html,2021-01-19 21:46:05.000 Z
9275f53348a1a69f5932afa2403bd2fd187388e4,Lindsey Graham is playing a very odd role in the Senate impeachment trial,https://www.cnn.com/2021/01/22/politics/lindsey-graham-donald-trump-impeachment-trial/index.html,2021-01-22 14:35:33.000 Z
4da723bf10434f33a80a812dac4a5020ef649915,Trump revokes rule barring lobbying by former officials as he leaves office,https://www.cnn.com/2021/01/20/politics/trump-revokes-lobby-ban/index.html,2021-01-20 10:48:21.000 Z
62161f4a31f82ffedd53d4ac1ee5f554be959442,Why do presidents use so many pens to sign documents — and what happens to them?,https://www.cnn.com/2021/01/22/us/pens-biden-executive-order-trnd/index.html,2021-01-22 21:20:41.000 Z
2afc95317e74ab741e1a8d196fbbb3352aef49b7,Here's why rioters say they're gathering in Portland,https://www.cnn.com/2021/01/22/us/portland-riot-protesters-charged/index.html,2021-01-23 18:39:17.000 Z
5e571168c9b57dd73e24fe75b8674437290cd377,Sen. Hawley blocks quick consideration of Biden's Homeland Security nominee,https://www.cnn.com/2021/01/19/politics/hawley-mayorkas-dhs/index.html,2021-01-20 01:15:36.000 Z
c3a12fdd3fef805f66cc90ffb81eddb8c49934cc,The powerful duality of Kamala Harris' ascent,https://www.cnn.com/2021/01/20/politics/kamala-harris-inauguration-racial-justice-white-supremacy/index.html,2021-01-20 18:41:31.000 Z
b462d7fadc99c4f5590a85bd3c904bb1ef15a1f4,Biden unveils Covid-19 plan based on 'science not politics' as he signs new initiatives,https://www.cnn.com/2021/01/21/politics/biden-national-coronavirus-plan/index.html,2021-01-22 03:25:16.000 Z
57265ad5afae6c74419964806e68c815e20c93ab,Divisive policies and actions from Trump-era that Biden could decide to alter,https://www.cnn.com/2021/01/21/politics/race-immigration-trump-era-policies-biden/index.html,2021-01-21 05:50:05.000 Z
27654cd8c9671c76308071448a3c319519812fa2,"Senate confirms Avril Haines as director of national intelligence, the first Biden Cabinet nominee confirmed",https://www.cnn.com/2021/01/20/politics/avril-haines-confirmation-vote/index.html,2021-01-21 01:45:15.000 Z
39ceee0b5022132d69f30b151053e21299e016bd,READ: President Joe Biden's schedule for his first full day in office,https://www.cnn.com/2021/01/21/politics/biden-first-full-day-schedule/index.html,2021-01-21 05:18:49.000 Z
f13d66d3355f82f6143542f4a015a85c9b6f4753,The most important line in Joe Biden's inaugural address,https://www.cnn.com/2021/01/20/politics/important-line-biden-speech/index.html,2021-01-20 21:00:27.000 Z
0121e77788776c5eff08da587da015c63141308c,The perfect optics on Inauguration Day,https://www.cnn.com/2021/01/21/opinions/perfect-optics-inauguration-day-opinion-mcgowan-silva/index.html,2021-01-21 17:48:30.000 Z
53a9285fca03a1cb0969293b2cdf49301412edde,Trump's business was crashing even before the Capitol riot made his brand toxic,https://www.cnn.com/2021/01/21/business/trump-business-hotels-pandemic/index.html,2021-01-21 18:28:48.000 Z
a2d1a5acbedba55cabd134677bff8caa98e7472d,McConnell privately says he wants Trump gone as Republicans quietly lobby him to convict,https://www.cnn.com/2021/01/22/politics/mcconnell-trump-impeachment-conviction-republicans/index.html,2021-01-23 20:17:12.000 Z
19a11ea49967d63247aa8a0db6bb7b5f1e688c15,DHS pauses some deportations for 100 days,https://www.cnn.com/2021/01/20/politics/homeland-security-pause-some-deportations/index.html,2021-01-21 04:49:10.000 Z
9b951443de50bcf084324600050028118817ddc4,Chronicling Trump's 10 worst abuses of power,https://www.cnn.com/2021/01/24/politics/trump-worst-abuses-of-power/index.html,2021-01-24 12:55:01.000 Z
5cbadce47e87a8bf291b2688ce36a8016ce0ae03,"World leaders welcome Biden with praise, pleas, and parting shots at Trump",https://www.cnn.com/2021/01/20/europe/global-reaction-joe-biden-inauguration-intl/index.html,2021-01-20 22:24:01.000 Z
5eec806841c06e39cf89a37e9cd0a0f351b9046a,"'No Time to Die,' the new James Bond film, is delayed once again",https://www.cnn.com/2021/01/21/media/no-time-to-die-james-bond-delay/index.html,2021-01-22 15:48:04.000 Z
1c5b6773e7dbccc5450ea0efa33cfa9972941230,Biden signs order requiring masks for travelers,https://www.cnn.com/travel/article/travel-us-mask-mandate-biden/index.html,2021-01-23 15:47:26.000 Z
223efcae801431edec36d5b31f1609948a58b8c9,Michigan county commissioner pulls gun out during virtual meeting when resident asked board to denounce Proud Boys,https://www.cnn.com/2021/01/22/us/michigan-county-commissioner-gun-proud-boys/index.html,2021-01-23 01:19:52.000 Z
f4abbc5c5075754314dd14920775a93a3843717f,"WNBA team Atlanta Dream, co-owned by Kelly Loeffler, is close to being sold, league says",https://www.cnn.com/2021/01/19/us/wnba-atlanta-dream-sale-kelly-loeffler-spt-trnd/index.html,2021-01-20 16:54:18.000 Z
17c3c3ce609057ed2ca8ae8a4760be32d492dfe6,"Group of House conservatives pushing to oust Liz Cheney, an effort Republican aides still view as a long shot",https://www.cnn.com/2021/01/19/politics/liz-cheney-house-conservative-reaction/index.html,2021-01-20 03:29:24.000 Z
7548ae801b9514ac856e80a4fc0625c548fdc13a,"Bernie Sanders, Gaga's outfit and other meme-able Inauguration moments. (But mostly Bernie)",https://www.cnn.com/2021/01/21/us/inauguration-bernie-sanders-memes-jokes-twitter-trnd/index.html,2021-01-22 02:30:37.000 Z
35382ca1da21dd5adc12e1d58d9e0e2e8cf9b50c,Last-minute Trump appointee at NSA put on administrative leave due to inspector general probe,https://www.cnn.com/2021/01/20/politics/michael-ellis-administrative-leave/index.html,2021-01-21 02:14:27.000 Z
05ad237b735be016e27944a4aee415a450d0a14a,11 sources of comic relief in this already long new year,https://www.cnn.com/2021/01/19/entertainment/comic-relief-winter/index.html,2021-01-19 16:50:26.000 Z
87450d17fb6bbb7d1f8ebe24e54a74dda06dadaa,Army changes account of key phone call on response to Capitol riot,https://www.cnn.com/2021/01/21/politics/army-changes-account-capitol-riot-call/index.html,2021-01-22 02:17:45.000 Z
f4bfbf1c7b245390cf57aab2445102d6d7573825,Ivanka Trump and Jared Kushner move out of DC and lease luxury condo in Miami,https://www.cnn.com/2021/01/21/politics/ivanka-trump-jared-kushner-luxury-condo-miami/index.html,2021-01-21 21:10:46.000 Z
cfba33a4ed5dc6ca92566f41769e1955e3d116e4,"Vice President Pence, remove Trump now",https://www.cnn.com/2021/01/06/opinions/pence-25-amendment-ghitis/index.html,2021-01-07 11:57:33.000 Z
990e5db8d880d6ba8f9daa5106686e33c4ec74f6,Mitch McConnell: Capitol Hill mob was 'provoked' by Trump,https://www.cnn.com/2021/01/19/politics/mitch-mcconnell-rioters-provoked/index.html,2021-01-19 23:57:20.000 Z
927329bdc830c033ca974448b4156d8db9d4d11a,The White House's latest excuse for Trump's silence on the Capitol attack is the worst yet,https://www.cnn.com/2021/01/18/politics/hogan-gidley-trump-january-6/index.html,2021-01-18 18:07:41.000 Z
bc9bad0faf4c0fd7438e0de9ca8b51317631135b,Portland braces for dueling protests: What we know,https://www.cnn.com/2019/08/14/us/portland-planned-protests-soh/index.html,2019-08-16 16:24:54.000 Z
9ceb04e3c11095567b75599a3f24602c1d448601,Kamala Harris was escorted to the ceremony by the Capitol Police officer who led rioters away from Senate,https://www.cnn.com/2021/01/20/us/kamala-harris-eugene-goodman-escort-trnd/index.html,2021-01-20 20:12:51.000 Z
cc44e4fe5e4645825f11c83663ce832062c47620,Obama and Harris share fist bump at inauguration in historic moment,https://www.cnn.com/2021/01/20/politics/obama-harris-fist-bump-inauguration/index.html,2021-01-20 22:52:11.000 Z
590310995f40447205e51d908264faedd575ad20,"Larry King, legendary talk show host, dies at 87",https://www.cnn.com/2021/01/23/us/larry-king-dies-trnd/index.html,2021-01-24 12:07:33.000 Z
7458fb2d2350c8f7ed33103e6ee1e0c153b41a3e,Key takeaways from the first confirmation hearings for Biden nominees,https://www.cnn.com/2021/01/19/politics/biden-confirmation-hearings-key-takeaways/index.html,2021-01-20 01:33:32.000 Z
d0c2e8fd4bfc7630255222c842971c15fcb4655e,CDC reports record number of daily Covid-19 vaccinations as states struggle with supply,https://www.cnn.com/2021/01/22/health/us-coronavirus-friday/index.html,2021-01-23 07:57:35.000 Z
8ad8c023c358b1a86960665833a8ff56af5bef6b,Exclusive: Trump advisor calls on Congress to approve Biden's rescue plan,https://www.cnn.com/2021/01/21/economy/stimulus-biden-trump-hassett/index.html,2021-01-22 21:06:57.000 Z
efd9ac34ce033196dd8cf76702064ec1b04389ef,"3 new Democratic senators sworn in, flipping control of the Senate",https://www.cnn.com/2021/01/20/politics/democratic-senators-swearing-in/index.html,2021-01-20 22:59:58.000 Z
d27d4748d91b3f87d0e00fe756442c871a0087fe,"Fact check: True to form, Trump makes multiple false claims in his final comments in office",https://www.cnn.com/2021/01/20/politics/fact-check-trump-final-video-speech-inauguration/index.html,2021-01-20 22:09:52.000 Z
ed71ce4524ed0e50ad6472019bf15db5496d56be,Trump pardons Steve Bannon as one of his final acts in office,https://www.cnn.com/2021/01/19/politics/steve-bannon-pardoned-by-trump/index.html,2021-01-20 12:08:33.000 Z
3023f8cd6ee77e7a752cba0ed224a2a67aa36331,3 National Guard soldiers killed in helicopter crash in New York state,https://www.cnn.com/2021/01/20/us/new-york-helicopter-crash/index.html,2021-01-21 19:53:01.000 Z
58d167a14be2605d5c1bb2c4c61c61e5a9cd7461,Capitol Police investigating after congressman discovered carrying a gun when attempting to go on the House floor,https://www.cnn.com/2021/01/22/politics/congressman-gun-capitol/index.html,2021-01-22 19:18:57.000 Z
7aca56611e1d6930e77b93a7e6c9c9fe7d41d90c,Inside Joe Biden's newly decorated Oval Office,https://www.cnn.com/2021/01/20/politics/inside-joe-biden-oval-office/index.html,2021-01-21 20:40:15.000 Z
737d551dbaec0496e815c360098281a83d8210fa,"Meet Ella Emhoff, the US presidential inauguration's breakout fashion star",https://www.cnn.com/style/article/ella-emhoff-inauguration-fashion-star/index.html,2021-01-21 07:23:24.000 Z
aacbd8144507f3f85369869ffb37dd8e09bebbc5,Donald Trump has a money problem,https://www.cnn.com/2021/01/21/politics/donald-trump-post-presidency-money/index.html,2021-01-22 01:08:12.000 Z
6ceb7a1bcc4ce3e1242aac6ff03ab81bc4b3d925,"There will be no Trump china collection due to cost and time, source says",https://www.cnn.com/2021/01/21/politics/trump-white-house-china/index.html,2021-01-21 15:45:08.000 Z
86a7ad8701a145451872642a1f5eedda2db3c674,New York Times: Trump and DOJ attorney had plan to replace his acting AG and undo Georgia election result,https://www.cnn.com/2021/01/22/politics/trump-doj-attorney-plan-replace-acting-ag-false-election-claims/index.html,2021-01-25 13:08:02.000 Z
0e10125561d99d714a577dcc4bd6972e0cb70a1e,"For flight attendants, getting people to wear masks is now one of the hardest parts of the job",https://www.cnn.com/travel/article/flight-attendants-unruly-passengers-masks-trnd/index.html,2021-01-21 22:08:29.000 Z
0f64a952aa74d2d6d04af037de5b2193873b9b90,Dustin Diamond completes first round of chemotherapy for cancer treatment,https://www.cnn.com/2021/01/21/entertainment/dustin-diamond/index.html,2021-01-22 02:00:51.000 Z
