article_id,headline,url,published_date
f4139c28b47af9cca7e29693af007d4c0b0d362b,Miscommunication and confusion led to National Guard troops being pushed out of Capitol,https://www.cnn.com/2021/01/22/politics/national-guard-garage-capitol-police-confusion/index.html,2021-01-23 01:04:37.000 Z
971e9465fab29da8e535e7eb73cf11d67a7e796e,Man charged with assaulting a police officer during US Capitol riots is denied bail,https://www.cnn.com/2021/01/20/us/capitol-rioter-assault-police-officer-arrest/index.html,2021-01-21 02:28:03.000 Z
01d7bc2f2eb2308f1669b79c388c1e37fb8b6ccb,More vaccines could be coming soon and they could be a big boost to the rollout,https://www.cnn.com/2021/01/22/health/covid-19-vaccines-johnson-and-johnson-next/index.html,2021-01-23 05:36:20.000 Z
dae96a3d44bfdddd9d7a7a624a6428cef230fc9c,"Alphabet is shutting down Loon, its ambitious internet balloon venture",https://www.cnn.com/2021/01/22/tech/loon-project-alphabet-google-intl-hnk/index.html,2021-01-22 17:16:37.000 Z
69e0c6e3bcd678313f9e2bd09153772c51170169,A big infrastructure spending bill might finally be in the cards,https://www.cnn.com/2021/01/20/economy/infrastructure-biden-stimulus/index.html,2021-01-20 19:43:11.000 Z
a8a12620e62e2bbb3f10a66cc1f50dfce0620fa1,Champ and Major Biden have not yet moved into the White House,https://www.cnn.com/2021/01/21/politics/biden-dogs-major-champ-white-house-pets/index.html,2021-01-22 00:41:39.000 Z
eab97b15df6bad8f77a7d0d25f3e413294f6dcb2,Larry King interview famously ends with Marlon Brando's on-the-mouth kiss,https://www.cnn.com/2021/01/23/us/larry-king-marlon-brando-interview-kiss/index.html,2021-01-23 23:08:51.000 Z
f9a52cbb1e92851edca8f2e310d627502c9abf9f,These Trump pardons spell the biggest threat,https://www.cnn.com/2021/01/20/opinions/trump-pardons-big-threat-to-us-integrity-rodgers/index.html,2021-01-20 23:27:14.000 Z
338621f7149f179410b18b5a9b1108b2d656dc80,What happened when my dad met a bully,https://www.cnn.com/2021/01/22/opinions/trump-bullying-and-fear-bardsley/index.html,2021-01-23 05:52:58.000 Z
5aec87734f403c77f23f389aae006cf9ed4f831d,History made: Renewable energy surpassed fossil fuels for European electricity in 2020,https://www.cnn.com/2021/01/24/business/eu-renewable-energy-fossil-fuels/index.html,2021-01-25 18:03:51.000 Z
a3536f5d85051807f4c67771bacc0f8608199691,Most common mistakes in online workouts that cause pain or injury,https://www.cnn.com/2021/01/22/health/proper-form-common-mistakes-online-workouts-wellness/index.html,2021-01-27 21:24:02.000 Z
9babb32aefe85a822263cc798a255f42c33041e1,The place that helped inspire American democracy,https://www.cnn.com/travel/article/qwow-finger-lakes-upstate-new-york-spc-intl/index.html,2021-01-22 23:09:11.000 Z
ebcae054e858ec9cb87af8f262a6d5cc0ec44e24,Trump administration officials flee to avoid holding him accountable,https://www.cnn.com/2021/01/09/opinions/trump-administration-cabinet-resignations-capitol-mob-dent/index.html,2021-01-10 01:32:22.000 Z
e6aab05f8553a0d07ee81753babe59d81f07a49a,Why Biden's vaccine goals are likely too modest and good politics,https://www.cnn.com/2021/01/24/politics/100-million-vaccine-doses-biden-analysis/index.html,2021-01-24 15:37:11.000 Z
a952fb1af3b92be99763b29dd400f15f2ff88f5e,Federal judge blocks Parler's bid to be restored on Amazon Web Services,https://www.cnn.com/2021/01/21/tech/parler-amazon-federal-judge/index.html,2021-01-21 22:55:04.000 Z
8fd673c19244b9bc37de31f7d9703d9fbf58486b,Nearly 2 years' worth of rainfall is possible in parts of Southern California over the next week,https://www.cnn.com/2021/01/20/weather/southwest-rain-forecast-pattern-change-drought/index.html,2021-01-20 11:00:55.000 Z
f7371e84f3ce4b2e4c6f96be61b5716968eb5273,4 ways Joe Biden plans to fix the economy,https://www.cnn.com/2021/01/20/economy/biden-economy/index.html,2021-01-20 14:11:35.000 Z
eda6bc68e22ecbbcc70e73e2544fe48beaa1bfc3,Trump-appointed head of Global Media agency resigns at Biden's request,https://www.cnn.com/2021/01/20/media/michael-pack-resigns/index.html,2021-01-20 23:46:39.000 Z
a2635ed70a5f6dc3e7e88bb8fd34701712957404,Amanda Gorman reminded America what poetry can do,https://www.cnn.com/2021/01/22/opinions/amanda-gorman-affirmed-poetry-and-me-ashley-m-jones/index.html,2021-01-22 17:31:23.000 Z
c0587cef8661f800b8f47c8af6520692fd45a1ad,A woman who won a $60 million lottery said she got the winning numbers from her husband's dream,https://www.cnn.com/2021/01/24/world/toronto-woman-60-million-lottery-husband-dream-trnd/index.html,2021-01-25 13:34:41.000 Z
7b4f10b8902f5a96f46f1f58213dd22438946776,Dwayne Johnson shows off his hair skills in an adorable post with his 2-year-old daughter,https://www.cnn.com/2021/01/23/us/dwayne-johnson-does-his-daughters-hair-trnd/index.html,2021-01-25 13:35:49.000 Z
80c5e0d20123abacb3eab74304b8cf32cdd1651d,Two educators in the same Georgia school district died within hours from Covid-19,https://www.cnn.com/2021/01/22/us/georgia-educators-die-within-hours-from-covid-19-trnd/index.html,2021-01-23 03:39:37.000 Z
c23e88de04a7ca931ab69313ab667067778bbfbb,What Dakota Johnson's moving performance as a dying woman taught her about living,https://www.cnn.com/2021/01/22/entertainment/our-friend-movie-dakota-johnson-interview/index.html,2021-01-24 16:25:04.000 Z
048f178eaa8a41f4c09e9795d8c438df7e22134f,Got a package you didn't order? It could be a scam,https://www.cnn.com/2021/01/23/business/package-didnt-order-brushing/index.html,2021-01-25 13:49:32.000 Z
1754c6fd5b255ecaf85b7f2426a3e94cf8d0ccad,Conor McGregor calls his return a 'wild ride' as he prepares to make comeback from third retirement,https://www.cnn.com/2021/01/21/sport/dustin-poirier-vs-conor-mcgregor-spt-intl/index.html,2021-01-22 13:57:15.000 Z
668fbbb7dc2ec591ef22a21683f1adaffe65fcd9,Foods that can reduce stress,https://www.cnn.com/2021/01/23/health/stress-relieving-foods-wellness/index.html,2021-01-23 06:58:22.000 Z
802a33f51ab5f6d04e0d2400e910a68c7fe8f093,Cole Sprouse not interested in a 'Suite Life of Zack and Cody' reboot,https://www.cnn.com/2021/01/20/entertainment/cole-sprouse-suite-life-reboot-trnd/index.html,2021-01-20 16:35:31.000 Z
5eaa27f53dc867c107f51db76a4baef7adb9f4d7,Lady Gaga and Jennifer Lopez perform at the inauguration,https://www.cnn.com/2021/01/20/entertainment/jennifer-lopez-inauguration/index.html,2021-01-21 11:52:07.000 Z
9b346bb1eb600abddd5f7abb22f9ebb59c4a828b,Justin Timberlake and Jessica Biel have a new baby -- and we know his name,https://www.cnn.com/2021/01/18/entertainment/justin-timberlake-baby-scli-intl/index.html,2021-01-18 17:22:37.000 Z
853a9077014c224dc8b7a7ec411f8f39fe59a4db,Humvee recovered after being stolen from military facility,https://www.cnn.com/2021/01/20/us/stolen-military-humvee-recovered-trnd/index.html,2021-01-20 23:51:28.000 Z
dd3e98c49f659afd1ad7a47ec710cb81da44f6eb,Richard Branson's mother dies of Covid-19,https://www.cnn.com/2021/01/11/business/richard-branson-mother-death-covid/index.html,2021-01-11 14:36:44.000 Z
c061601517b4d5e3735977c59ebba1b6ccfb24be,Afghanistan foils ISIS plan to assassinate the top US envoy to Kabul,https://www.cnn.com/2021/01/13/middleeast/isis-assassination-attempt-us-intl/index.html,2021-01-13 22:19:31.000 Z
3cf676d3dd1a59be9e8e2e24f8666e272abc07da,Is the QAnon movement dead?,https://www.cnn.com/2021/01/21/politics/qanon-conspiracy-donald-trump/index.html,2021-01-21 14:43:05.000 Z
768ed570309a97af396826408c97c1a523722a66,Texas attorney general sues Biden administration over deportation pause,https://www.cnn.com/2021/01/22/politics/texas-biden-lawsuit-deportation/index.html,2021-01-22 20:11:21.000 Z
5aa1891767b15c39b6971ab00caadafdffff3aad,He took sanctuary in a church more than 3 years ago. He just returned home because of a new Biden policy,https://www.cnn.com/2021/01/22/us/north-carolina-jose-chicas-leaves-sanctuary/index.html,2021-01-23 16:16:31.000 Z
0f48035d79af561ce31367000b1f906a04171bee,Here's why it's not snowing much in the North but it's coming down in the South,https://www.cnn.com/2021/01/23/weather/lack-of-northern-snow-polar-vortex/index.html,2021-01-23 14:26:28.000 Z
65d1fc8c6cd1a153334c3eb5ed5df81aaf12266b,Glastonbury Festival fashion history: Remember when Kate Moss wore rain boots?,https://www.cnn.com/style/article/kate-moss-glastonbury-fashion-remember-when/index.html,2021-01-22 04:34:20.000 Z
e84ba6976edf2500d37f991a79c00fd36b0e10e9,READ: Youth poet laureate Amanda Gorman's inaugural poem,https://www.cnn.com/2021/01/20/politics/amanda-gorman-inaugural-poem-transcript/index.html,2021-01-21 03:22:55.000 Z
4a294dd47362379e7d8780f64081803bfd1ad30a,States complain that demand for the Covid-19 vaccine is outpacing supply,https://www.cnn.com/2021/01/19/health/covid-19-vaccine-demand-outpacing-supply/index.html,2021-01-19 12:16:35.000 Z
4a00cbdb7a822064bd2720efbe01165f578d3e8b,"Trinity Rodman, daughter of the NBA legend, drafted 2nd overall in pro soccer league",https://www.cnn.com/2021/01/14/us/trinity-rodman-draft-nwsl-spt-trnd/index.html,2021-01-14 12:01:20.000 Z
27a2a4949920ec6bd3cf36ebe6a72492540ef1cb,South Korean former Olympic skating coach jailed for 10 years over abuse,https://www.cnn.com/2021/01/22/asia/south-korea-olympics-abuse-intl-hnk/index.html,2021-01-22 06:41:20.000 Z
7d809e95ad39db2fb460ae7181e00dd4e1ae23fa,"Mick Norcross, 'The Only Way Is Essex' star, found dead at 57",https://www.cnn.com/2021/01/22/entertainment/mick-norcross-death-scli-intl-gbr/index.html,2021-01-22 11:16:16.000 Z
6ab428f68d0fa9a6405a508751acc8ef0b9ee4ff,'The Simpsons' seemed to get it right again -- by predicting part of the inauguration,https://www.cnn.com/2021/01/22/us/simpsons-lisa-harris-inauguration-trnd/index.html,2021-01-22 07:01:21.000 Z
85bbcb733594f6f47ef310375be18cdfdc90e040,Volkswagen CEO joins Twitter and immediately trolls Tesla and Elon Musk,https://www.cnn.com/2021/01/21/business/vw-ceo-herbert-diess-tweet-trolls-elon-musk/index.html,2021-01-21 19:31:05.000 Z
fe4525a4c18b857a075fc26d3fde995dc1076251,"How animals transfer power from one leader to another: Brute force, inheritance and consensus",https://www.cnn.com/2021/01/20/world/animals-leadership-transfer-power-scn/index.html,2021-01-20 09:40:08.000 Z
0dc502c9dfe4dbd472cfc5a745f8b1d3361b05ed,Novak Djokovic says 'good intentions' were 'misconstrued' following backlash to list of proposals,https://www.cnn.com/2021/01/20/tennis/sloane-stephens-loses-grandfather-while-in-australian-open-quarantine-spt-intl/index.html,2021-01-20 15:40:46.000 Z
55d403a6bf05f99e2b36daf2724e54a354d5af9d,Challenging reductive stereotypes of rural Appalachian life -- in photos,https://www.cnn.com/style/article/rich-joseph-facun-black-diamonds-swing/index.html,2021-01-20 11:59:39.000 Z
17ff9c6f6647ef8a0c1811a838302c8203bb0608,What made 'Celebrating America' soar,https://www.cnn.com/2021/01/21/opinions/celebrating-america-biden-inauguration-seymour/index.html,2021-01-21 06:50:17.000 Z
56c1483483fbd5347966c07ee36c963fb48cd497,Why you won't find Sean Hannity and Tucker Carlson on British TV,https://www.cnn.com/2021/01/16/media/fox-news-uk-ofcom/index.html,2021-01-18 17:28:40.000 Z
69f4244b86d3101b2c02a7e4eecc2dd1b9902ab5,Iran's Rouhani hopes Biden will return to Obama-era nuclear deal as he dubs Trump a 'tyrant',https://www.cnn.com/2021/01/20/middleeast/iran-biden-nuclear-deal-intl-hnk/index.html,2021-01-20 08:23:57.000 Z
f01aeca4e92b51965902c1415c0c64a80d2cc15b,At least 32 killed as first suicide bombing in nearly 2 years rocks Baghdad,https://www.cnn.com/2021/01/21/middleeast/iraq-baghdad-explosion-intl/index.html,2021-01-22 10:12:51.000 Z
e5d276307aaf417897b67bfc74eda96a4ded281c,"For one year, this man is eating only what's grown at Dubai's Sustainable City",https://www.cnn.com/2021/01/20/middleeast/dubai-sustainable-city-food-experiment-spc-intl/index.html,2021-01-21 01:45:06.000 Z
4e6669151b5a11ccd79e02c93a170d7c18ef36e4,"Bus heading to the Grand Canyon crashes, killing one and injuring dozens",https://www.cnn.com/2021/01/22/us/arizona-grand-canyon-bus-crash/index.html,2021-01-23 01:57:39.000 Z
fc788f945c41698c3f9d71e54f5769181ee88adc,These coronavirus variants are keeping scientists awake at night,https://www.cnn.com/2021/01/19/health/coronavirus-variants-what-we-know/index.html,2021-01-20 02:38:57.000 Z
6695d3901fa9941ad1c3099bf30b32a6a6f5d0d2,Capitol riot investigators narrow in on extremist groups and military-style coordination,https://www.cnn.com/2021/01/19/politics/extremist-groups-military-coordination-capitol-riot/index.html,2021-01-19 18:46:44.000 Z
d105da209b80aa4698f6147956ec774cfb19ed92,Washington state announces partnership with companies including Starbucks and Microsoft to boost vaccinations,https://www.cnn.com/2021/01/19/us/washington-state-vaccinations-plan-partnerships/index.html,2021-01-19 09:40:56.000 Z
60722ba080f15e1f94b9fd3c693aabb3dab445d6,Study finds 60% of Americans don't know where or when to get a Covid-19 vaccine,https://www.cnn.com/2021/01/22/health/americans-no-info-where-when-vaccine/index.html,2021-01-22 22:07:34.000 Z
89e3eeb0275f489039cf50ecb333e3a2c57ebc3b,"If Biden wants to fix health care, he will need Republicans",https://www.cnn.com/2021/01/21/opinions/biden-gop-health-care-solutions-chen/index.html,2021-01-21 19:37:37.000 Z
5f0a8deac036ea9778d8abd9b780b468fbaef65e,'Ghost Ship' leaseholder pleads guilty in connection to blaze that killed 36,https://www.cnn.com/2021/01/22/us/ghost-ship-fire-guilty-plea/index.html,2021-01-22 22:45:31.000 Z
5c5febf756782abd59a313dceb562389ebcfc346,Melania Trump departing White House with lowest favorability of her tenure,https://www.cnn.com/2021/01/17/politics/melania-trump-favorability/index.html,2021-01-17 16:20:20.000 Z
74e5075a2e119d805726d0e9bdbe79bdba9f3f13,Families find throwing laptops and Wi-Fi at students isn't enough to bridge digital divide,https://www.cnn.com/2021/01/23/us/education-digital-divide-in-coronavirus/index.html,2021-01-23 18:15:09.000 Z
997163fd7ba7e97185a4f62aeee1428db366ce38,Robert Saleh says being the first Muslim head coach in the NFL is a humbling experience,https://www.cnn.com/2021/01/24/us/new-york-jets-nfl-muslim-coach-history-trnd/index.html,2021-01-24 12:55:59.000 Z
6776b3b30b8a95f9aafcbafd7d4492a778fa5838,Biden's Covid plan has to work. The economy depends on it,https://www.cnn.com/2021/01/22/economy/vaccine-coronavirus-economy-biden/index.html,2021-01-22 15:32:09.000 Z
1f890594e4af193e10263a114fd91d6abe0b405d,The White House contact form now lets people choose their personal pronouns,https://www.cnn.com/2021/01/21/politics/white-house-website-pronouns-trnd/index.html,2021-01-22 17:33:46.000 Z
0fcb5a431eb50f9fe3c32885487ffbd71095fb7e,"Customer leaves 'Covid sucks!' message and a $1,400 tip at a Colorado restaurant",https://www.cnn.com/2021/01/23/us/colorado-covid-sucks-tip-trnd/index.html,2021-01-23 20:02:41.000 Z
a0a7c94c2e3e2c485dfa92cfe953bb8f7710e74b,Burial ground reveals Stone Age people wore clothing covered in elk teeth,https://www.cnn.com/2021/01/22/world/stone-age-people-elk-teeth-scn/index.html,2021-01-22 18:57:02.000 Z
b57395a3b7e8bb991a45fb5aa29d07cf11f67761,This is the right-wing media problem in a microcosm,https://www.cnn.com/2021/01/12/opinions/talk-radio-cumulus-trump-disinformation-hemmer/index.html,2021-01-12 23:10:08.000 Z
f40aacac1c0fbd5a8440eaabcce374503740b1e0,Women and girls are wearing pearls and Converse to honor Vice President Harris,https://www.cnn.com/style/article/pearls-converse-kamala-harris-inauguration-trnd/index.html,2021-01-20 17:32:28.000 Z
814d7d1e672f00404d5e017374485bf22b502bb2,SpaceX launches 143 satellites on one rocket in record-setting mission,https://www.cnn.com/2021/01/24/tech/spacex-rideshare-transporter-mission-scn/index.html,2021-01-25 17:53:29.000 Z
6c554a71e6b86e28b6985cbeed7f13404c46e86d,Impeachment trial hangs over Biden's first days in office,https://www.cnn.com/2021/01/21/politics/impeachment-state-of-play-congress/index.html,2021-01-21 13:23:12.000 Z
66fb857b260ef4482f9c731365e0915ed076d6b8,The people who saved America's democracy,https://www.cnn.com/2021/01/21/opinions/biden-inauguration-save-democracy-zelizer/index.html,2021-01-21 18:22:33.000 Z
d8662e1ef6349627ab26a59be3ea8d3178abab85,Top general apologizes for appearing in photo-op with Trump after forceful removal of protesters,https://www.cnn.com/2020/06/11/politics/milley-trump-appearance-mistake/index.html,2020-06-11 19:58:08.000 Z
f104b1bce9028822095db6ce6e4db29f8a5269a9,Army Secretary says National Guard's riot response was hampered by archaic system,https://www.cnn.com/2021/01/18/politics/army-secretary-mccarthy-interview/index.html,2021-01-19 01:57:16.000 Z
22916c8c4ec6a9cd8b60dd64361f3e500052fd5c,More than two dozen former Republican lawmakers endorse Joe Biden on first day of GOP convention,https://www.cnn.com/2020/08/24/politics/former-congressional-republicans-endorse-joe-biden/index.html,2020-08-24 13:20:11.000 Z
0d1d434d82fcabbdd02f5a01c4260030dda87b48,"Gregory Sierra, 'Sanford and Son' and 'Barney Miller' actor, dies at 83",https://www.cnn.com/2021/01/23/entertainment/gregory-sierra-obituary-trnd/index.html,2021-01-23 09:05:49.000 Z
c58c070da2266dba3dde6893816d03a15867fa08,California man injured in apparent shark attack off Maui,https://www.cnn.com/2021/01/22/us/hawaii-shark-bite-trnd/index.html,2021-01-23 01:34:07.000 Z
a5c211a099138ceb1c36f1b1fc5746bc718ff5e3,Mitch McConnell has one more card to play against Donald Trump,https://www.cnn.com/2021/01/13/politics/mitch-mcconnell-donald-trump-impeachment/index.html,2021-01-13 20:46:53.000 Z
007cd607a2fdbc4c698832b98689c5df6c8c46f5,What motivated the Capitol rioters,https://www.cnn.com/2021/01/19/opinions/capitol-rioters-motivation-tsavaris/index.html,2021-01-19 22:22:35.000 Z
70a1d020faed256e568d888308c55ef3c691c56e,"Members of extremist Oath Keepers group planned attack on US Capitol, prosecutors say",https://www.cnn.com/2021/01/19/politics/oath-keepers-capitol-riot-charges/index.html,2021-01-20 01:28:40.000 Z
578de31637c8f1189181131ac95b07981a74aebe,"Model Stephanie Seymour arrested, accused of DUI",https://www.cnn.com/2016/01/18/us/model-stephanie-seymour-arrested-dui/index.html,2016-01-19 01:59:01.000 Z
75c256db19ae6a440577c5aa183d09e8cf185c11,The world's most powerful passports for 2021,https://www.cnn.com/travel/article/henley-index-world-best-passport-2021/index.html,2021-01-06 12:55:35.000 Z
55d3e22e144c814c4bf04a9eed78ee1a748b261b,Selena Gomez hopes her knife skills make the cut in new season of 'Selena + Chef',https://www.cnn.com/2021/01/22/entertainment/selena-gomez/index.html,2021-01-22 19:57:38.000 Z
5a19c4a497b741d98a8f831d1b573f59e96780a3,Biden pushes to reopen schools within 100 days,https://www.cnn.com/2021/01/21/politics/school-reopening-biden-100-days/index.html,2021-01-21 20:42:05.000 Z
f01853239bb1ae3e5ecb8084e39fdb858544db45,7 strategies for truly restorative rest,https://www.cnn.com/2021/01/24/health/restorative-sleep-strategies-wellness/index.html,2021-01-24 16:28:44.000 Z
3e4b77ab624169688cb7aefbf23006d4f2a56f7b,Here's how to buy bitcoin without all the risk of buying bitcoin,https://www.cnn.com/2021/01/21/investing/bitcoin-stocks/index.html,2021-01-21 19:33:06.000 Z
4ee098e7c35c472aa8f3116a6af4c5667c16c669,How some states are administering Covid-19 vaccines at twice the speed of others,https://www.cnn.com/2021/01/15/health/states-vaccinating-faster-west-virginia/index.html,2021-01-16 20:37:36.000 Z
a00a2a7720e183e598f41c8b42e4445335a2a4f8,Inside Europe's stunning abandoned churches,https://www.cnn.com/style/article/abandoned-churches-francis-meslet/index.html,2020-12-29 00:54:14.000 Z
25fc29c838a8ca51d7fdc66b0562858bf67cf8dc,Vaccination rates highlight stark differences between Israelis and Palestinians -- amid row over responsibility,https://www.cnn.com/2021/01/18/middleeast/israelis-palestinians-vaccination-intl/index.html,2021-01-18 05:28:04.000 Z
346c2b3eabcc2a49988dc14643fb958726a49419,Newly discovered giant galaxies dwarf the Milky Way,https://www.cnn.com/2021/01/21/world/giant-radio-galaxies-discovery-scn/index.html,2021-01-21 19:52:33.000 Z
25bd10ea9a544836675ac98e9c8a8bd791e1d721,The abandoned Soviet nuclear missile base hidden in a Polish forest,https://www.cnn.com/travel/article/poland-borne-sulinowo-soviet-nuclear-missiles/index.html,2021-01-23 03:10:23.000 Z
aa69057784796145ffa163b5ea6b95cbdb7a09ac,There was much more to Hank Aaron than breaking Babe Ruth's record,https://www.cnn.com/2021/01/22/opinions/so-much-more-to-hank-aaron-moore/index.html,2021-01-22 23:50:02.000 Z
8ee15aa714ab0d8b0a57d62a483ee48b75ccf5cd,"Severe allergic reactions to Moderna's Covid-19 vaccine are rare, CDC says",https://www.cnn.com/2021/01/22/health/moderna-severe-allergic-reactions-rare/index.html,2021-01-22 23:48:21.000 Z
b38cb1d061da04da1b3bc14082317a2f9e9fd300,"Covid variant found in UK may be more deadly than others, says Boris Johnson",https://www.cnn.com/2021/01/22/uk/uk-variant-scientists-johnson-intl/index.html,2021-01-22 17:56:50.000 Z
2e74a067e0d42ff95a4bbf9ed97c9708fdd668ad,Now America can inspire the world again,https://www.cnn.com/2021/01/20/opinions/biden-inauguration-ukraine-scherba/index.html,2021-01-21 00:47:40.000 Z
b606391fbe564f583e1ee3eadf101f4bd69be319,The whole world is watching Biden as he takes charge,https://www.cnn.com/2021/01/18/opinions/world-watching-biden-rebuild-americas-image-andelman/index.html,2021-01-18 20:14:55.000 Z
37d795c958d17fa6270ea65c5ecdca8f83378d61,Larry King was the everyman's interviewer,https://www.cnn.com/2021/01/23/media/legacy-larry-king-career-bill-carter/index.html,2021-01-23 22:30:28.000 Z
b7e68cb371fdc32293b672887548d3cf00c8023c,"The untold story of Ann Lowe, the Black designer behind Jackie Kennedy's wedding dress",https://www.cnn.com/style/article/ann-lowe-jackie-kennedy-wedding-dress/index.html,2020-12-23 13:45:48.000 Z
3eba0a0dbd34ed1a3ddd31a9c20c94b689f30345,Naomi Osaka revealed as the new face of Louis Vuitton,https://www.cnn.com/style/article/naomi-osaka-louis-vuitton/index.html,2021-01-12 05:07:12.000 Z
d1a5b149a7b6d90ec90f2955807a8f7797d32c83,Amazon to Biden: Prioritize our workers for the vaccine,https://www.cnn.com/2021/01/20/tech/amazon-biden-vaccine-letter/index.html,2021-01-20 23:17:41.000 Z
f4c1cb7fb139aed82c0ad47bb1f94cbaa991df25,Shep Smith breaks his silence about why he left Fox News,https://www.cnn.com/2021/01/20/media/shep-smith-fox-amanpour/index.html,2021-01-20 16:17:04.000 Z
0c46a2e122173c423d72a7a74a4ce5820228ca1f,Succession: Presidential and Vice Presidential Fast Facts,https://www.cnn.com/2013/08/27/us/succession-presidential-and-vice-presidential-fast-facts/index.html,2020-09-30 17:02:00.000 Z
27597d1e5f7fcf7d08f51c45861b1425c2892cea,How a 'Hamilton' song helped Amanda Gorman overcome a speech impediment,https://www.cnn.com/2021/01/21/us/amanda-gorman-hamilton-speech-impediment-trnd/index.html,2021-01-21 15:12:35.000 Z
572490792aedf99fe892f0960dbfdedd992c8247,History teachers revisit their curriculum after the Capitol riots,https://www.cnn.com/2021/01/23/us/history-teachers-curriculum-capitol-riots/index.html,2021-01-23 10:58:38.000 Z
0a667e3200e48d0a0199385ea81a569da0b0da4b,Obama cuts sentences of hundreds of drug offenders,https://www.cnn.com/2017/01/17/politics/obama-cuts-sentences-of-hundreds-of-drug-offenders/index.html,2017-01-17 22:18:44.000 Z
a8452a1d02e24504524ecfcf785502a36698f155,'The Masked Dancer' reveals the celebrity hiding under Cricket,https://www.cnn.com/2021/01/21/entertainment/masked-dancer-cricket/index.html,2021-01-21 18:12:15.000 Z
4951492a864b6b70fc9aff684026a72f3a5ae9bb,"Mantecore, the white tiger that attacked during Siegfried & Roy show, dies",https://www.cnn.com/2014/03/26/showbiz/siegfried-roy-tiger/index.html,2014-03-26 17:02:59.000 Z
e5b869393456d0840b726d0b8f1aef66723a315b,Tim McGraw wasn't so sure about Taylor Swift naming a song after him,https://www.cnn.com/2021/01/21/entertainment/tim-mcgraw-taylor-swift-song-trnd/index.html,2021-01-21 14:45:28.000 Z
18588fd8989add71958951f34fa58a9849ca63f8,"If you call 911, it can take 2-3 minutes longer to get help now",https://www.cnn.com/2021/01/22/health/covid-19-triage-emergency-care/index.html,2021-01-24 15:29:27.000 Z
c5b029a20fa9d4f5d329a5c70918bedd9f781000,The Black cowboys and cowgirls of American cities -- in photos,https://www.cnn.com/style/article/kennedi-carter-black-cowboys-swing/index.html,2021-01-19 18:23:32.000 Z
5c8c13176b37fdbf343df40b8e3d8d0a07fe1ba4,"Wall Street can relax, moderates have the mandate",https://www.cnn.com/2021/01/22/investing/stocks-biden-harris-moderates/index.html,2021-01-22 18:54:46.000 Z
364f0404b7d196240c2f3632c63e1b39b04fae93,How to grow tomatoes in the Arabian Desert,https://www.cnn.com/2020/08/18/world/pure-harvest-agritech-dubai-global-gateway-spc-intl/index.html,2020-11-18 16:56:55.000 Z
af8b7a2d176f33ab6cf6cb2041947520c83696df,Biden's opening with Republicans is narrow but real,https://www.cnn.com/2021/01/24/politics/joe-biden-republicans-bipartisanship/index.html,2021-01-24 16:05:44.000 Z
236548bc6cd9856eb692daf2b2eb49a7bd8b0f92,"Sorry, folks -- your dog doesn't really know what you're talking about",https://www.cnn.com/2020/12/08/europe/dog-brain-activity-intl-scli-scn/index.html,2020-12-09 09:34:01.000 Z
dfa007e0a6978507dccc0845bab5c7dde6829aaa,Japan and IOC determined to hold Tokyo Olympics despite cancellation rumors,https://www.cnn.com/2021/01/21/asia/tokyo-olympics-coronavirus-intl-hnk/index.html,2021-01-22 12:12:40.000 Z
4b4b327081f6daafe48bf6823944e91afe016ce3,Kremlin critic Alexey Navalny to be held in custody for 30 days following his return to Russia,https://www.cnn.com/2021/01/18/europe/navalny-court-russia-intl/index.html,2021-01-18 14:58:33.000 Z
3cbea4bf050f9eaa822549d1c6d723a0f6d7143e,Google agrees to pay French publishers for news,https://www.cnn.com/2021/01/21/tech/google-pays-french-publishers/index.html,2021-01-21 17:43:49.000 Z
