article_id,headline,url,published_date
cf9edf0ad24897d5b2b2241f14abf56b7ef0c553,Larry King has been hospitalized with Covid-19,https://www.cnn.com/2021/01/02/media/larry-king-covid-19/index.html,2021-01-02 23:30:24.000 Z
297a0599dff9d6017b9dcf1766ec77ebc8846da2,'I can't breathe' is deeply personal,https://www.cnn.com/2020/06/04/opinions/black-doctor-i-cant-breathe-deeply-personal-farrand/index.html,2020-06-04 20:02:10.000 Z
35ffc67dacad773809b86f4cbb514bb4f2ae809d,White House has signed off on Joe Biden getting the President's Daily Brief,https://www.cnn.com/2020/11/24/politics/trump-biden-pdb-transition/index.html,2020-11-25 08:55:50.000 Z
147d2876fb63bc9aad974469355945ab6ac9899f,"New Zealand woman, 19, dies after suspected shark attack",https://www.cnn.com/2021/01/08/asia/new-zealand-shark-attack-intl-hnk/index.html,2021-01-08 09:30:59.000 Z
60e4dd3351cc32fdc5dd6becd3c96b9e8c115831,Trump holds event honoring Native American veterans in front of Andrew Jackson picture,https://www.cnn.com/2017/11/27/politics/donald-trump-andrew-jackson/index.html,2017-11-28 03:44:10.000 Z
26d357ee9623fa9a1331f852bb1f593e83446313,Grammy-winning producer and convicted murderer Phil Spector dies,https://www.cnn.com/2021/01/17/entertainment/phil-spector-death/index.html,2021-01-17 22:08:26.000 Z
104bbc0e002a1d882ee6c8b643ab7c57b1e3e6f5,"Wealthy homeowners are getting richer, while first-time buyers struggle",https://www.cnn.com/2021/01/15/success/wealth-divide-housing-market/index.html,2021-01-15 18:10:36.000 Z
a02ff6306b93130e92128f035f6191384ccab042,"John Reilly, actor known for 'General Hospital,' has died",https://www.cnn.com/2021/01/11/entertainment/john-reilly-actor-death-trnd/index.html,2021-01-12 13:33:30.000 Z
9961a14acb219104e41e4a91db31cddf427e5d41,"Yes, you can still get infected with Covid-19 after being vaccinated. Here's why",https://www.cnn.com/2021/01/08/health/covid-vaccinated-infected-wellness/index.html,2021-01-08 19:41:16.000 Z
d83b9f4db56f55919b1423d0145718cd0b7ddc5b,House impeaches Trump for 'incitement of insurrection',https://www.cnn.com/2021/01/13/politics/house-vote-impeachment/index.html,2021-01-14 00:26:56.000 Z
9e2580443b39b4685e4bcbca5eb4b9b0b36dbd57,Trump fires Secretary of Defense Mark Esper,https://www.cnn.com/2020/11/09/politics/trump-fires-esper/index.html,2020-11-09 23:31:46.000 Z
0842f8533809d7316e1734477f9f39715340fb70,How President Trump's surprise gift to '60 Minutes' completely backfired,https://www.cnn.com/2020/10/26/politics/donald-trump-60-minutes-book-lesley-stahl-health-care/index.html,2020-10-26 15:22:10.000 Z
bb54dbe0b873053445569e3a040987772118c5d2,"Parler has now been booted by Amazon, Apple and Google",https://www.cnn.com/2021/01/09/tech/parler-suspended-apple-app-store/index.html,2021-01-11 11:54:10.000 Z
ef9941de7ecd82e3d39f34bf9fd3ef1f1b199abf,How Trump is using the pandemic to crack down on immigration,https://www.cnn.com/2020/07/07/politics/trump-administration-pandemic-immigration-changes/index.html,2020-07-14 22:53:03.000 Z
d1ab9a89fccb3e695c9e9ccf4e16e7abe7217990,What GOP lawmakers who refused to wear masks during Capitol lockdown need now,https://www.cnn.com/2021/01/13/opinions/covid-masks-capitol-siege-republicans-filipovic/index.html,2021-01-14 01:51:10.000 Z
cd92a11af2c79018289f0219dab697d265330367,Mitch McConnell's dilemma,https://www.cnn.com/2021/01/14/opinions/trump-impeachment-what-republicans-face-jennings/index.html,2021-01-15 16:07:44.000 Z
eec163f977f4ca4bdb23a77cb7a0d6010a0c11cd,Repealing Obamacare? Here's how Congress could do it,https://www.cnn.com/2016/11/10/politics/donald-trump-republicans-obamacare/index.html,2016-11-11 21:50:10.000 Z
6635618d28ceb89924e76e9b4d29d50959f827fc,Biden urges America to mask up for 100 days as coronavirus surges,https://www.cnn.com/2020/12/03/politics/biden-harris-interview-covid-mask/index.html,2020-12-04 15:08:33.000 Z
d335627e0ed180d0ad2b4956da2122ba35b7e89b,"UK should cut its 12-week delay between vaccine doses, doctors group says",https://www.cnn.com/2021/01/23/health/uk-covid-vaccine-delay-bma-gbr-intl/index.html,2021-01-23 17:15:43.000 Z
d4f64c3458b86d9597eb0177515386d2b15d384d,When will Americans see the aid from Biden's relief proposal? It's up to Congress,https://www.cnn.com/2021/01/16/politics/biden-economic-relief-coronavirus-stimulus-checks/index.html,2021-01-17 14:03:37.000 Z
4192d029702835df1c7a7c472afdd1c55665d413,"Capitol Police officer who died when mob stormed the Capitol was proud to serve his nation, family said",https://www.cnn.com/2021/01/08/us/brian-sicknick-death/index.html,2021-01-09 21:15:17.000 Z
7b61638e5296cdef025d547569fc7710ea86e971,"Paramount+ streaming service will launch March 4, replacing CBS All Access",https://www.cnn.com/2021/01/19/media/paramount-viacomcbs-date/index.html,2021-01-19 18:54:31.000 Z
45df566f6a786a4abd8b406eae58cc5c8a43b892,Is Donald Trump's grip on the GOP slipping?,https://www.cnn.com/2021/01/15/politics/donald-trump-pew-poll-approval/index.html,2021-01-15 21:31:17.000 Z
c9c23681f90f1ed5ac5cd91c19a817061637b0f9,Anna Wintour defends controversial Vogue cover of Kamala Harris,https://www.cnn.com/style/article/kamala-harris-vogue-cover-anna-wintour-response/index.html,2021-01-12 16:53:47.000 Z
ed075aeddbbbda5609d691030511a57ccb036e05,Oscar-tipped film 'Mank' is bathed in Old Hollywood glamour,https://www.cnn.com/style/article/mank-movie-costume-design/index.html,2020-12-04 10:29:11.000 Z
854b28d3a4e2a5c0a27ed7827f534f5eab5b2a2f,Trump's ex-White House chief of staff John Kelly supports using 25th Amendment to remove the President,https://www.cnn.com/2021/01/07/politics/john-kelly-trump-25th-amendment-capitol-riot-cnntv/index.html,2021-01-08 02:41:46.000 Z
cae8cec51465b715f7301817dfa13996f42000dc,"20,000 National Guard troops expected in Washington for Biden's inauguration",https://www.cnn.com/2021/01/13/politics/inauguration-security-us-secret-service-washington/index.html,2021-01-14 00:03:40.000 Z
ce5d1bbcefd3a94a83ff6e310729d63de77ff2c1,Ford closes German plant for 1 month as global chip crisis worsens,https://www.cnn.com/2021/01/18/business/ford-auto-chip-shortage/index.html,2021-01-18 17:56:15.000 Z
169da459246867e97f2318c61c564a5fc46b18b1,Yoga for stress-related insomnia,https://www.cnn.com/2020/11/02/health/yoga-stress-insomnia-wellness/index.html,2020-12-22 02:49:15.000 Z
895402964120b4f7930e01a9cae81fc220db9db9,"Biden to nominate William Burns as CIA director, turning to a longtime diplomat to lead agency in post-Trump era",https://www.cnn.com/2021/01/11/politics/william-burns-cia-director-nomination/index.html,2021-01-11 12:03:39.000 Z
82a925ed1e4c164f202ec07faacadcd8a5dcaed9,Trump administration begins formal withdrawal from World Health Organization,https://www.cnn.com/2020/07/07/politics/us-withdrawing-world-health-organization/index.html,2020-07-08 08:53:10.000 Z
5626beb60c9471cda8340de300704f8d23f91490,Chris Gethard's highly addictive 'Beautiful/Anonymous' podcast hits 250 episodes,https://www.cnn.com/2021/01/19/entertainment/chris-gethard-beautiful-anonymous/index.html,2021-01-19 18:44:18.000 Z
41cca907e57fc723ac6900df5c5747ed42a69ae1,Trump signs coronavirus relief and government funding bill into law after lengthy delay,https://www.cnn.com/2020/12/27/politics/trump-relief-bill-christmas-eve/index.html,2020-12-28 11:00:41.000 Z
d40ad4de0be584e2582e0d55a92f64a4d8ea66d7,"With Trump a no-show, Mar-a-Lago guests left to party maskless with Rudy Giuliani and Vanilla Ice",https://www.cnn.com/2021/01/01/politics/mar-a-lago-new-years-eve/index.html,2021-01-01 20:32:22.000 Z
75f01c7a303dc4dfe7399f5bc399b860a2eb7d43,Lil Wayne is not here for Black Lives Matter,https://www.cnn.com/2016/11/02/entertainment/lil-wayne-black-lives-matter/index.html,2016-11-02 18:55:01.000 Z
bb350dc03f5c157db2cde6fd35473ba6acadabfa,Don't ignore this headline: The pandemic is getting worse. What happens next is up to you,https://www.cnn.com/2021/01/15/health/covid-19-pandemic-getting-worse/index.html,2021-01-15 20:25:35.000 Z
06d2c1c4d689907d0ac43229aa9024ed772b2775,'Sir' alert: This one word is a telltale sign Trump is being dishonest,https://www.cnn.com/2019/07/16/politics/sir-trump-telltale-word-false/index.html,2019-07-17 21:25:26.000 Z
225037fa08f759c16b69a227096c4f610250283e,A distant galaxy dies as astronomers watch,https://www.cnn.com/2021/01/11/world/distant-galaxy-death-scn/index.html,2021-01-11 16:05:00.000 Z
4001096528b2619538c87c5bfa3e8205e2340a13,Government watchdog concludes Trump administration broke law by withholding Ukraine aid,https://www.cnn.com/2020/01/16/politics/gao-report-administration-violated-law-withholding-aid/index.html,2020-01-16 17:21:22.000 Z
6e0ab74edc30242c7780a745265c64b36631c30a,"Obstruction by Trump failed because others refused to 'carry out orders,' Mueller report says",https://www.cnn.com/2019/04/18/politics/obstruction-of-justice-trump-mueller-report/index.html,2019-04-18 18:45:15.000 Z
571374846d8d3640e3a50726827d9200397c0ad9,First on CNN: Key government agency acknowledges Biden's win and begins formal transition,https://www.cnn.com/2020/11/23/politics/transition-biden-gsa-begin/index.html,2020-11-24 11:14:40.000 Z
4f6dc13ed7c5ee66ee8fb2798ccedcc17772e932,America's Cup: Patriot 'flying yacht' capsizes in gusty conditions,https://www.cnn.com/2021/01/17/sport/americas-cup-american-magic-capsizes-spt-intl/index.html,2021-01-17 16:40:24.000 Z
a8867a8207790bb2241df774996d5a449d3d80a2,Iran Fast Facts,https://www.cnn.com/2013/06/03/world/meast/iran-fast-facts/index.html,2021-01-24 15:07:08.000 Z
f536cf8496275d3b1605d9d1ef67b0c9a0725c29,Trump's been impeached again. What's next?,https://www.cnn.com/2021/01/13/politics/senate-impeachment-process-next-steps/index.html,2021-01-14 14:52:47.000 Z
da1fcc146867ef07351cbed0c7357b643f386d92,Pelosi demands acting Pentagon chief halt his order to NSA to install Trump loyalist as general counsel,https://www.cnn.com/2021/01/18/politics/pelosi-trump-nsa-michael-ellis/index.html,2021-01-18 19:27:09.000 Z
d300750e7a9f3f312b28d997e2d90ad12417c0d9,Doorbell camera captures a woman saving her neighbors from their burning home,https://www.cnn.com/2021/01/06/us/arizona-woman-saves-neighbors-from-burning-home-trnd/index.html,2021-01-06 14:16:52.000 Z
c74b6691ba98499b9066278eb597fe39ab19f4f5,The young designer subverting the ruffle to empower women,https://www.cnn.com/style/article/tia-adeola-fashion-designer-wcs/index.html,2020-09-15 10:43:04.000 Z
9dc3a973e1b2269061c4cd898b9b3271ea1eb5be,Why the search for the perfect vegan leather starts on the forest floor,https://www.cnn.com/style/article/vegan-leather-alternatives-fungi-biofabric-scn/index.html,2020-09-29 10:42:32.000 Z
0084db47e4dd9a4606fcb7ca1cf9891b65305d58,Larry King files for divorce after almost 22 years of marriage,https://www.cnn.com/2019/08/21/entertainment/larry-shawn-king-divorce/index.html,2019-08-21 12:48:34.000 Z
e8af4d7f1449f101794e4536597c8b1bd310330e,No plans to test most National Guard for Covid-19 before they deploy across DC,https://www.cnn.com/2021/01/15/health/national-guard-dc-deploy-coronavirus-testing/index.html,2021-01-16 01:22:10.000 Z
920c73838108c06bb2c308b1217e8ad39dd8801a,"A ring with 12,638 diamonds sets a Guinness World Record",https://www.cnn.com/style/article/guinness-world-record-diamonds-ring-style-trnd/index.html,2021-01-04 02:01:21.000 Z
c474012aa55fda7575f4f55a52fd659b74d2a836,Seattle Police disperse protesters from occupied CHOP area after emergency order,https://www.cnn.com/2020/07/01/us/seattle-chop-protesters/index.html,2020-07-01 23:55:36.000 Z
2fa47c4f2083e6ba17c5df4b917345a26dc3c7ce,"Empowering, alluring, degenerate? The evolution of red lipstick",https://www.cnn.com/style/article/red-lipstick-history-beauty/index.html,2020-03-12 15:47:35.000 Z
84486a55911198a0967c905911dde1cce566a392,Army reservist with secret-level security clearance among the latest charged in connection with Capitol riot,https://www.cnn.com/2021/01/17/politics/capitol-riot-latest-charged-army-reservist/index.html,2021-01-18 17:36:52.000 Z
b5647d0360421cb476f3de822c76946842eeeeef,Deutsche Bank won't do any more business with Trump,https://www.cnn.com/2021/01/12/investing/deutsche-bank-trump/index.html,2021-01-12 17:20:25.000 Z
090d24c2164871715143233d44172ab85d6d395c,"Congress completes electoral count, finalizing Biden's win after violent delay from pro-Trump mob",https://www.cnn.com/2021/01/06/politics/2020-election-congress-electoral-college-vote-count/index.html,2021-01-07 08:41:36.000 Z
44329dd9e0e3d72e1cd93898633271789f14557b,Here's why we can have some hope about the Covid pandemic,https://www.cnn.com/2021/01/13/health/covid-pandemic-reasons-for-optimism/index.html,2021-01-14 04:25:03.000 Z
9e26347801db2ce81f16d7ea434d12ca41390712,Chaos at the top of China's biggest chipmaker,https://www.cnn.com/2020/12/16/tech/smic-executive-resignation-intl-hnk/index.html,2020-12-16 11:14:36.000 Z
3cb551723cccb27d6b45ced6de2415e304aad8ac,The real self-driving revolution remains years away,https://www.cnn.com/2021/01/21/success/self-driving-car-technology-2021/index.html,2021-01-21 17:54:04.000 Z
8af49fd08c3c519d0e98d895d229f1fcc5bd10d3,Analysis: What does Biden's diverse Cabinet mean for a divided country,https://www.cnn.com/2021/01/18/politics/diversity-joe-biden-cabinet-analysis/index.html,2021-01-19 19:11:13.000 Z
e2b4a4e8451e5d88dcc61d7db9ab9a223425a56e,A teenager saved her family when they lost their sense of smell from Covid-19 and didn't realize their house was on fire,https://www.cnn.com/2021/01/18/us/17-year-old-saves-family-fire-covid-smell-trnd/index.html,2021-01-18 17:23:33.000 Z
e8c7ad39759214ad3dc0adc9939d52bb15941f53,Should we give a damn about the Oxford comma?,https://www.cnn.com/2017/03/19/opinions/oxford-comma-ambiguity-opinion-mcwhorter/index.html,2017-03-19 20:04:11.000 Z
451a8d4a031ea25c69806cbf84c8c78153200011,Biden's ambitious 100-day plan to erase Trump's legacy,https://www.cnn.com/2021/01/17/opinions/biden-ambitious-first-hundred-days-zelizer/index.html,2021-01-18 00:06:51.000 Z
22e0663f812a82e52245e804668c1f7aae3413e8,Razer's new face mask ventilates the air and amplifies your voice,https://www.cnn.com/2021/01/13/americas/razer-smart-face-mask-scli-intl-wellness/index.html,2021-01-13 19:38:09.000 Z
083241df079ede6cc8a0b74c788110a986bd096b,"As Biden prepares to be inaugurated, a journalist hopes the war on truth is over",https://www.cnn.com/2021/01/19/media/joe-biden-donald-trump-war-on-truth-reliable-sources/index.html,2021-01-20 18:26:28.000 Z
5b2997945c3c03f1b829cbc93fff99da13ebeed1,"If you want to travel next year, you may need a vaccine passport",https://www.cnn.com/2020/12/27/tech/coronavirus-vaccine-passport-apps/index.html,2020-12-28 12:27:56.000 Z
a3740345fd305fc640503c1cb086c524960a9588,"Trump-branded properties charged federal government at least $1.2 million, records show",https://www.cnn.com/2020/03/12/politics/trump-branded-properties-charge-taxpayers-a-million-invs/index.html,2020-03-12 18:16:35.000 Z
6898ec5bd8a0f3855135285f0cb8c2a66d411b0a,'The Flight Attendant' serves up a fun trip thanks to Kaley Cuoco,https://www.cnn.com/2020/11/25/entertainment/the-flight-attendant-review/index.html,2020-11-25 15:14:22.000 Z
396519d5cf282b6c6304f22fa08f828dbc39b50a,Paraplegic athlete in wheelchair climbs 820 feet up Hong Kong skyscraper,https://www.cnn.com/2021/01/17/asia/lai-chi-wai-hong-kong-wheelchair-intl-hnk-scli/index.html,2021-01-18 07:17:06.000 Z
60fdf4dad8a2e06f13b4904337131ae45bc233ec,Here's who Joe Biden has selected for his Cabinet,https://www.cnn.com/2020/11/24/politics/biden-cabinet-picks/index.html,2021-01-12 18:58:12.000 Z
510806c7ea5afb965e8481172f51f25dd8343dbd,Covid-19 'superspreader' in northeast China linked to 102 infections,https://www.cnn.com/2021/01/18/asia/china-covid-superspreader-intl-hnk/index.html,2021-01-18 15:21:33.000 Z
6bf9be3b933e7863e4a8ead27780b4910134a741,"Acting ICE director is resigning, DHS official says",https://www.cnn.com/2021/01/13/politics/acting-ice-director-resigns/index.html,2021-01-14 12:31:10.000 Z
8870d72b59cdf7130ff9fc56a5b08102b5597f0b,Trump leaves office with a good — but not historically great — stock market record,https://www.cnn.com/2021/01/20/investing/dow-stock-market-trump-presidency/index.html,2021-01-20 21:20:03.000 Z
cd98d074e111b8f154dd5fc0fb0f9998f21de851,Metal detectors infuriate lawmakers as some Republicans erupt over new measures,https://www.cnn.com/2021/01/13/politics/house-floor-metal-detectors/index.html,2021-01-13 21:43:00.000 Z
7e6d379155b4259248746c163ccf5ab3b4d40028,Olympic gold medalist Klete Keller charged for alleged role in Capitol riots,https://www.cnn.com/2021/01/13/politics/olympic-medalist-klete-keller-charged-capitol-riot-spt-trnd/index.html,2021-01-14 03:21:13.000 Z
9741a0d4412b61b7945acc8c3613eac71c46c03f,DC attorney general says Trump could possibly be charged by city prosecutors with misdemeanor for role in Capitol insurrection,https://www.cnn.com/2021/01/17/politics/dc-karl-racine-potential-charge-trump-capitol-riot/index.html,2021-01-17 19:23:02.000 Z
dbf5cf1d7e3176eee1ab9d7f1aaaf58c2d41c3c1,Call out Trump's big lie,https://www.cnn.com/2021/01/14/opinions/trumps-big-lie-impeachment-lockhart/index.html,2021-01-15 11:49:09.000 Z
32dc743b2beadc06b94e925b9772e07b8e411bb3,31% of Asian Americans say they've been subject to racist slurs or jokes since the coronavirus pandemic began,https://www.cnn.com/2020/07/01/us/coronavirus-discrimination-study/index.html,2020-07-01 19:28:36.000 Z
68e5ea0f86089848345c164b6bac3812fe5fc292,"Germany's ex-royals want their riches back, but past ties to Hitler stand in the way",https://www.cnn.com/style/article/hohenzollern-prince-georg-prussia/index.html,2020-12-30 14:10:56.000 Z
a308200ccb2a2a572e15a19c8cc372d3b30a7176,A curator's museum is filled with looted African art. Now he wants it returned,https://www.cnn.com/style/article/brutish-museums-benin-bronzes/index.html,2020-12-03 14:37:14.000 Z
a499549bc94e1c77d2b689fd75abe3398838a991,What we know about the 5 deaths in the pro-Trump mob that stormed the Capitol,https://www.cnn.com/2021/01/07/us/capitol-mob-deaths/index.html,2021-01-08 22:29:36.000 Z
2572db060233fbef2da94773fd32423d0d7edf8c,Trump hand-picks replacement for Atlanta's US attorney after surprise resignation,https://www.cnn.com/2021/01/05/politics/georgia-us-attorney-byung-pak-bobby-christine/index.html,2021-01-05 19:29:46.000 Z
aaa348b6f0242394e7972f285efdd9d46b51e122,Trump travel ban: Here's what you need to know,https://www.cnn.com/2017/01/30/politics/trump-travel-ban-q-and-a/index.html,2017-01-30 14:10:28.000 Z
cd10eb0c31d7131c6bc222aa9ee53dd032b51212,"Trump announces wave of pardons, including Papadopoulos and former lawmakers Hunter and Collins",https://www.cnn.com/2020/12/22/politics/trump-pardons/index.html,2020-12-23 11:14:57.000 Z
74594805e073774235fde8dfbae86031abcbf0c5,Controversial ad for make-up wipe pulled in China after backlash over alleged victim-blaming,https://www.cnn.com/2021/01/11/asia/purcotton-china-ad-metoo-intl-hnk/index.html,2021-01-11 06:38:46.000 Z
8b6c348bdf0a145d1ab2b8829aee2fa81539c766,Trump announces pardon for Michael Flynn in tweet,https://www.cnn.com/2020/11/25/politics/trump-pardon-michael-flynn/index.html,2020-11-26 00:05:31.000 Z
dc5a1998b168d94128c788dc2a2f9f7c1cd6913e,Acting Secretary of Homeland Security Chad Wolf resigns; FEMA Administrator Pete Gaynor to take over,https://www.cnn.com/2021/01/11/politics/chad-wolf-homeland-security/index.html,2021-01-12 02:21:19.000 Z
8d35d5307d6003f10d443acc4cf33302f9bafdd9,Trump enablers Pence and McConnell are far too late in standing up to Trump,https://www.cnn.com/2021/01/06/opinions/trumps-political-enablers-are-too-late-dantonio/index.html,2021-01-06 23:16:08.000 Z
be4362c2b745be991f82208704268990c15106de,Biden nominates Dr. Vivek Murthy to reprise role as US surgeon general,https://www.cnn.com/2020/12/06/politics/vivek-murthy-surgeon-general/index.html,2020-12-07 13:39:04.000 Z
3663e02d3c6792dc1873450483fd587d6249230f,Pablo Escobar's chief hitman 'Popeye' dies of cancer,https://www.cnn.com/2020/02/06/world/pablo-escobar-hitman-popeye-dies-trnd/index.html,2020-02-07 01:55:40.000 Z
362780e63eed82bd0928e03c09e2c65e2e4c1a55,Then-candidate Joe Biden made a secret hospital visit to meet a wounded police officer,https://www.cnn.com/2021/01/22/us/houston-biden-officer-visit-trnd/index.html,2021-01-22 22:54:37.000 Z
5c3ef9b414101ab6b2dd1233a3730dc2f2da7260,"How tourism, gentrification and a pandemic have changed Asia's street food scene",https://www.cnn.com/travel/article/asia-taiwan-street-food-markets/index.html,2020-12-23 04:32:23.000 Z
44027d0d7a4b9ead9a1cba36861ba767c558b850,"Joanne Rogers, the widow of Fred Rogers, star of 'Mister Rogers' Neighborhood,' has died",https://www.cnn.com/2021/01/14/entertainment/joanne-rogers-fred-rogers-dead/index.html,2021-01-15 00:56:52.000 Z
9b9ca22e08dc5eb6694f204ca1f764174e06334a,"Trump acquitted at end of months long impeachment process, found not guilty of two articles",https://www.cnn.com/2020/02/05/politics/senate-impeachment-trial-vote-acquittal/index.html,2020-02-05 23:49:35.000 Z
92d5a01284ce8b52c421b764cf6b96596a3f45ef,Former Trump communications director says President lied about 2020 election and should consider resigning,https://www.cnn.com/2021/01/08/politics/alyssa-farah-trump-lied-resignation-cnntv/index.html,2021-01-08 15:32:30.000 Z
0394ca410c6cd576b123bac38df9291bb728bd6c,Oil and Gasoline Fast Facts,https://www.cnn.com/2013/07/30/world/oil-and-gasoline-fast-facts/index.html,2021-01-20 14:32:50.000 Z
e8876c81f2574e0fb025d279afae3cb85d449e93,This 5-minute meditation routine will calm you down,https://www.cnn.com/2020/09/02/health/5-minute-meditation-stress-reducer-wellness/index.html,2020-09-02 07:54:03.000 Z
dbed86d6af9073f36f602c3df87535dbc5bd979d,Trump would be only the 4th president to boycott his successor's inauguration,https://www.cnn.com/2021/01/09/politics/history-presidents-missing-inaugurations/index.html,2021-01-10 00:30:57.000 Z
3424c88c80ab888ba905529e8668dbf4377ebda7,The world marks 2 million coronavirus deaths. The real toll is likely much higher,https://www.cnn.com/2021/01/15/world/two-million-coronavirus-deaths-intl/index.html,2021-01-19 23:05:12.000 Z
e8a2428367bdf6737b14468c6929b9f8d47093ff,Yellen to urge lawmakers to 'act big' on relief spending,https://www.cnn.com/2021/01/18/economy/yellen-treasury-biden-economy/index.html,2021-01-18 23:02:15.000 Z
9d45fe1a1b3a6c149ec3149a3a5538b82b395253,Ugandan President Museveni wins re-election in vote his rival says was rigged,https://www.cnn.com/2021/01/16/africa/uganda-presidential-election-yoweri-museveni-bobi-wine-intl/index.html,2021-01-16 19:23:28.000 Z
8593c53fd0af5fb534dd5a5cc23fa3a985878e7c,The new US Covid-19 test requirement for travelers: What you need to know,https://www.cnn.com/travel/article/united-states-travel-new-covid-test-requirement/index.html,2021-01-25 22:27:00.000 Z
c20282c5a0fe4f50b1a67fe41ffcc14df77576fb,PGA cancels plans to play 2022 championship at Trump golf course,https://www.cnn.com/2021/01/10/business/pga-championship-trump-golf-course/index.html,2021-01-11 16:01:32.000 Z
9c6a0eca261c86b695739484cbe452efbc15b844,'Kill him with his own gun': Police describe facing the mob at the Capitol,https://www.cnn.com/2021/01/14/politics/police-officers-capitol-riot-hodges-fanone/index.html,2021-01-15 04:33:55.000 Z
df32399644795c407a44d1f91eb4be960cba51b2,Mesut Ozil joins Fenerbahce from Arsenal as he vows to be a 'Gunner for life',https://www.cnn.com/2021/01/24/football/mesut-ozil-arsenal-fenerbahce-transfer-spt-intl/index.html,2021-01-24 17:45:55.000 Z
ae66426403a963022d97d62219b97f6998f70ad6,Air quality regulator temporarily suspends cremation limits for LA County amid 'backlog' from pandemic,https://www.cnn.com/2021/01/18/us/california-crematoriums-limit-suspension-coronavirus/index.html,2021-01-18 09:17:44.000 Z
519711e98cc69a23bba03b9566ce9353ba90f982,Doctor on Covid's first year: We made a lot of mistakes,https://www.cnn.com/2021/01/15/opinions/covid-19-first-year-mistakes-sepkowitz/index.html,2021-01-15 20:04:52.000 Z
fcb8751dd3751fb25f77fc74d426a326a0dec809,'Harry Potter' actress Jessie Cave says her baby is out of hospital after contracting Covid-19,https://www.cnn.com/2021/01/08/entertainment/jessie-cave-update-covid-scli-gbr-intl/index.html,2021-01-08 13:11:46.000 Z
c256a642e97a5f8ad13e424998f8040b31df6f8c,"If he wins Uganda election, Museveni will work with his seventh US president. Here's how the US has helped him stay in power",https://www.cnn.com/2021/01/13/africa/museveni-uganda-election-intl/index.html,2021-01-13 10:28:51.000 Z
607c9ff8d98bd6378f77c450696864468bbeb09f,"Police hunt for man who allegedly injected woman, 92, with 'fake Covid-19 vaccine'",https://www.cnn.com/2021/01/08/uk/fake-vaccine-appeal-scli-intl-gbr/index.html,2021-01-08 13:19:02.000 Z
065dda6772ec0fcf52bfb6e83be416d5f77f3850,"Police respond differently when it's a left-wing protest, study finds",https://www.cnn.com/2021/01/15/us/protest-disparity-study-trnd/index.html,2021-01-16 18:00:48.000 Z
3fa9de1e8a22984d60bfcadcc4de6983c1778a60,DC attorney general wants to interview Donald Trump Jr. as part of Trump inaugural funds abuse probe,https://www.cnn.com/2021/01/14/politics/dc-attorney-general-donald-trump-jr-inaugural-funds-abuse/index.html,2021-01-15 01:39:04.000 Z
b51d80e55bb8261ed8166046819bfbf940881fb2,Tim Cook: Why I kicked Parler off Apple's App Store,https://www.cnn.com/2021/01/17/tech/tim-cook-apple-parler/index.html,2021-01-18 17:22:50.000 Z
001b305991ef92af17c6f3aac436f23e4923d3ad,People are calling for museums to be abolished. Can whitewashed American history be rewritten?,https://www.cnn.com/style/article/natural-history-museum-whitewashing-monuments-statues-trnd/index.html,2020-07-12 13:12:45.000 Z
