article_id,headline,url,published_date
1230fa06f1c4899a10d870b84baeddeeded4df83,He went down the QAnon rabbit hole for almost two years. Here's how he got out,https://www.cnn.com/2020/10/16/tech/qanon-believer-how-he-got-out/index.html,2020-10-18 20:27:41.000 Z
895daab5405661d62b88ff71fc7ea33b3b6f4e10,Rand Paul's dire prediction for the GOP,https://www.cnn.com/2021/01/18/politics/rand-paul-senate-conviction-trump-gop/index.html,2021-01-19 08:14:37.000 Z
8a1361054616df55d8db083eee3d8a0bd1150de7,Washington Monument closed 'until further notice' due to Covid-19,https://www.cnn.com/2021/01/23/politics/washington-monument-closed-coronavirus/index.html,2021-01-23 23:32:56.000 Z
1390ba1f6c7f003f7e74af0af4f40a25a2e88eb5,When will international travel return? Here's what we know right now,https://www.cnn.com/travel/article/international-trips-2021-pandemic/index.html,2021-01-11 14:24:44.000 Z
ef5e54b7cf6d04307a8d3da60afc1bd4ba28faae,Trump's legacy will take years to purge from the American psyche,https://www.cnn.com/2021/01/19/politics/donald-trump-presidency/index.html,2021-01-19 12:14:14.000 Z
3d6276e116c607435e1ca4e411b9f3772dbbf4ca,"Trump moves to lift some Covid-19-related travel restrictions, but Biden plans to block the order",https://www.cnn.com/2021/01/18/politics/trump-covid-travel-restrictions/index.html,2021-01-19 01:27:00.000 Z
01cd86ea8810cf3e0266c33577d7693b69282865,'The sky's the limit on where this can go' -- The worlds of Fortnite and football collide,https://www.cnn.com/2021/01/19/sport/fortnite-and-football-worlds-collide-spt-intl/index.html,2021-01-19 15:31:53.000 Z
7a3f17d92631cbeaf65de43c0c2bf6d420942503,Trump administration issues racist school curriculum report on MLK day,https://www.cnn.com/2021/01/18/politics/1776-commission-report-donald-trump/index.html,2021-01-19 00:52:19.000 Z
2ecf609f18a90c115236b63d294953283838ac46,'Simpsons' predicted Trump presidency in 2000,https://www.cnn.com/2016/03/17/entertainment/simpsons-trump-presidency-thr-feat/index.html,2016-03-17 21:01:43.000 Z
fbef7c8cdd5c67a40a877ae22684ee626ac0e032,Trump's sordid pardons cement his corrupt legacy,https://www.cnn.com/2021/01/17/opinions/trump-presidential-pardons-avlon/index.html,2021-01-18 02:38:27.000 Z
715e9050931c81304568d06b76c38bb7ad06bdad,What happened when I tried to become French,https://www.cnn.com/travel/article/trip-changed-my-life-southern-france/index.html,2020-07-08 12:02:13.000 Z
869757c5663319381b8f66499282bbb9efffe69e,Defense Secretary Lloyd Austin orders review of military sexual assault prevention programs,https://www.cnn.com/2021/01/24/politics/dod-sexual-assault-order/index.html,2021-01-24 19:32:48.000 Z
83f7e50bcfe3f0a13ebf4d622789100f382fdc05,Travel and the coronavirus pandemic: Everything you need to know,https://www.cnn.com/travel/article/coronavirus-travel-advice/index.html,2020-03-23 18:22:29.000 Z
2a72e87c72c59c77167a197ccaa614ec8ee29f7e,Russian President Vladimir Putin takes an icy dip to mark Epiphany,https://www.cnn.com/2021/01/19/europe/putin-epiphany-dip-russia-scli-intl/index.html,2021-01-19 16:48:42.000 Z
cc3888a91e37eae6c5c5ba3d68c4b96b872203c1,38 Capitol Police officers test positive for Covid-19 after Capitol riot,https://www.cnn.com/2021/01/24/politics/capitol-police-riot-coronavirus/index.html,2021-01-24 23:18:08.000 Z
74dbebf5bbe9cd1fc1bb45e4cc191b1eedc18bb7,Cruise line says only vaccinated passengers can sail,https://www.cnn.com/travel/article/saga-cruises-vaccine/index.html,2021-01-22 17:33:13.000 Z
de64251245305c2e434d3318d01b63a4fda36404,Tension rises between Pentagon and Biden transition team over meetings,https://www.cnn.com/2020/12/18/politics/pentagon-dod-transition-briefings/index.html,2020-12-18 20:26:11.000 Z
544361d96dd290d930560247c9fa5a3bb4671b5a,You can do this total-body workout anywhere -- no equipment needed,https://www.cnn.com/2020/12/04/health/full-body-lockdown-workout-no-equipment-wellness/index.html,2020-12-19 21:54:16.000 Z
fb4062f9b3e93c94b1fe3cde424a3a481e0c26ee,'Tiger' puts Tiger Woods' life and career back under the microscope,https://www.cnn.com/2021/01/08/entertainment/tiger-review/index.html,2021-01-08 15:33:45.000 Z
328de1136f5005b04e6a466c9713e10cf0355612,Chicago school district delays in-class start after teachers union votes to continue remote work,https://www.cnn.com/2021/01/24/us/chicago-teachers-union-remote-work-vote/index.html,2021-01-24 20:56:57.000 Z
cc251830578813fd97e94e3ddd99865cf849a0f9,Astronaut artifacts on moon -- like Apollo landers and Neil Armstrong's bootprint -- now protected by US law,https://www.cnn.com/2021/01/21/world/astronaut-artifacts-on-moon-scn-partner/index.html,2021-01-21 08:50:11.000 Z
509c9930524411feff953b8bf36c653b56f1971e,The weaponization of a first lady's image,https://www.cnn.com/style/article/the-weaponization-of-a-first-ladys-image/index.html,2020-10-27 13:00:57.000 Z
8de9f41f409256c291fc243690db9016ba2280c8,Why women feel pressured to shave,https://www.cnn.com/style/article/why-women-feel-pressured-to-shave/index.html,2020-03-03 21:46:49.000 Z
98fae5c31f84f823382f4360fb8686360f2f423b,"LeBron James says 'it would be great' for LA Lakers to visit the White House, should Covid-19 protocols allow",https://www.cnn.com/2021/01/22/sport/lebron-james-la-lakers-covid-19-white-house-spt-intl/index.html,2021-01-22 11:36:18.000 Z
7cb564c5788ab737c5c51dffd448a862e9595820,Bow Wow apologizes after crowded Houston club backlash,https://www.cnn.com/2021/01/20/entertainment/bow-wow-concert-apology/index.html,2021-01-20 15:00:43.000 Z
99dba4eb2b1f89ef8faa2e8470c69c4af484772a,A seesaw for kids on the US-Mexico border wins Beazley Design of the Year,https://www.cnn.com/style/article/beazley-design-2020-winners/index.html,2021-01-19 11:27:42.000 Z
7b4dd9b710ec749eb2c732107a97aed809e026dc,Dr. Dre is back home after being hospitalized in Los Angeles,https://www.cnn.com/2021/01/18/entertainment/dr-dre-home-hospitalization-trnd/index.html,2021-01-18 06:02:35.000 Z
3c87837c590596b099fd5afc44862cf1fc3734e9,Vegan restaurant becomes first in France to earn a Michelin star,https://www.cnn.com/travel/article/france-vegan-restaurant-michelin-star-intl-scli/index.html,2021-01-21 21:37:06.000 Z
1cd15e3dd4239f2d6c721b6fdb7a1382cf2e7092,Census chief quits early after final round of citizenship controversy,https://www.cnn.com/2021/01/18/politics/census-director-resigns/index.html,2021-01-18 21:16:56.000 Z
1d0c2f948061c097834c6c4fb68e7bfdce8255d1,Democratic lawmaker accuses Boebert of giving tours prior to insurrection,https://www.cnn.com/2021/01/18/politics/steve-cohen-lauren-boebert-capitol-tours/index.html,2021-01-19 00:21:52.000 Z
c0d74c162079c97c4b640c13e26f87b0a1e2e172,Couple spends lockdown making over Irish stately home,https://www.cnn.com/travel/article/castle-ward-northern-ireland-lockdown/index.html,2021-01-11 14:05:36.000 Z
ef67c0c830f8ca81e7e7e096396751cb2828f364,Congress' inaction could leave more Americans hungry -- especially kids,https://www.cnn.com/2020/09/19/politics/congress-food-assistance-hunger/index.html,2020-09-19 09:49:43.000 Z
4855089a4e730861feb6d9ae232d1a3eadfcbb5f,"NFL to allow 22,000 fans at Super Bowl LV, including 7,500 vaccinated health care workers",https://www.cnn.com/2021/01/22/us/super-bowl-fans-spt/index.html,2021-01-22 17:33:27.000 Z
e5f07c888af7aacdde3f0be5f8784e4e2982581e,The Seychelles drops quarantine requirement for Covid-vaccinated travelers,https://www.cnn.com/travel/article/seychelles-opens-vaccinated-travelers/index.html,2021-01-19 14:45:33.000 Z
0da9918d4cba4ec48826d36bce7adfa94e15dafd,"Johnson & Johnson coronavirus vaccine generates immune response, few side effects, in early trials",https://www.cnn.com/2021/01/13/health/johnson-coronavirus-vaccine-early-trials/index.html,2021-01-13 22:18:37.000 Z
2a281c45dc36dfe2dd38d46d85ff61a6b26f7c85,Biden was sworn in on a storied 19th century family Bible,https://www.cnn.com/2021/01/20/politics/biden-inauguration-family-bible/index.html,2021-01-20 18:18:38.000 Z
5dee56515507531405d7adddc4e595bc33985c00,"'We should be less afraid to be afraid,' says Emily Harrington after historic El Capitan climb",https://www.cnn.com/2020/12/18/sport/emily-harrington-el-capitan-climb-record-cmd-spt-intl/index.html,2020-12-18 11:47:49.000 Z
e0d0d57ddf4cb9eec2bb9324125ecf5e0f92361f,Larry King's son and daughter die within weeks of each other,https://www.cnn.com/2020/08/22/media/larry-king-children-died-trnd/index.html,2020-08-23 00:18:49.000 Z
2090399335de7b0fb5fa2ff9cbe97caf31e0f5cf,A Michigan marijuana dispensary is offering a free joint to anyone who gets a Covid-19 vaccine,https://www.cnn.com/2021/01/23/us/michigan-marijuana-free-weed-vaccine-trnd/index.html,2021-01-23 09:58:43.000 Z
f955a50463edd99367080868c6686f29e6f9f272,What Latinos want to hear from Biden,https://www.cnn.com/2021/01/24/opinions/latinos-vote-biden-morales/index.html,2021-01-24 23:08:58.000 Z
75b6c24cfacce49693d79ba6bae1d34ce8f605a0,'Beauty is freedom': The North Korean millennials wearing makeup to rebel against the state,https://www.cnn.com/style/article/north-korea-womens-beauty-freedom/index.html,2020-03-03 10:26:38.000 Z
352b9ec2e31d160b95cdfd9c5093fffd55f9c851,YouTube's Alex Okosi sees 'tremendous' opportunity in Africa's creative market,https://www.cnn.com/2021/01/20/africa/youtube-alex-okosi-opportunity-africa-spc/index.html,2021-01-20 13:32:13.000 Z
882eff1a7ae20ed22087d474ce33b05088a2c1df,Biden admin launches review of Trump decision to designate Yemen's Houthis as foreign terrorist organization,https://www.cnn.com/2021/01/22/politics/houthi-designation-review/index.html,2021-01-22 23:59:42.000 Z
787240437517630f6a4900f045993a5756cb9993,Birx stung by first public attack from Trump,https://www.cnn.com/2020/08/04/politics/trump-birx-coronavirus-tweet/index.html,2020-08-04 14:07:33.000 Z
a946e6952e110f8ae29c8264a91c7ae048d34b27,"As Trump leaves the stage, Republicans grapple with new conspiracy caucus",https://www.cnn.com/2021/01/16/politics/qanon-gop-trump-congress-future/index.html,2021-01-16 20:34:42.000 Z
259241cab0848e8e5852bba13b198e41bcd498b3,"The President might want Trump World, but he needs a real library",https://www.cnn.com/2021/01/18/politics/what-matters-january-18/index.html,2021-01-19 14:04:00.000 Z
d505cd9f0d07398291a17b179a460b24fcc43eb3,Biden administration braces for new wave of migrants as it rolls out new immigration plans,https://www.cnn.com/2021/01/18/politics/biden-border-immigration-migrants/index.html,2021-01-19 00:37:20.000 Z
80f101bd025a5757cdf531e1abf6f8be74f0410e,Tensions intensify between Biden and Pentagon over stalled transition briefings,https://www.cnn.com/2020/12/23/politics/pentagon-biden-tension/index.html,2020-12-23 20:17:39.000 Z
abd73a0df6f589c3406ebc5dd88b663c57b4ca28,Trump explodes at Nixon comparisons as he prepares to leave office,https://www.cnn.com/2021/01/14/politics/donald-trump-presidency-ending/index.html,2021-01-15 01:28:59.000 Z
745409d78ce24b6759175db127203ca9099578fc,US ambassador blocked from visiting Bobi Wine as official warns 'don't cry for Ugandans',https://www.cnn.com/2021/01/19/africa/us-embassy-uganda-wine-intl/index.html,2021-01-19 16:16:59.000 Z
e6d44aa92bfc585341fd2efc1b81adf5278ce22c,The GOP has become the party that stands for nothing,https://www.cnn.com/2021/01/14/opinions/gop-party-that-stands-for-nothing-wierson-honan/index.html,2021-01-15 00:25:35.000 Z
a2dda73d0004a94ee8d10079c2a8ff04366b60a9,"In Biden's Oval Office, Cesar Chavez takes his place among America's heroes",https://www.cnn.com/2021/01/21/us/cesar-chavez-bust-oval-office-trnd/index.html,2021-01-21 19:41:59.000 Z
e364ff51a3dbd47f5963a99438507c923aca835b,"Jailed for life over plot to behead police officer, Britain's youngest convicted terrorist is now 'suitable for release'",https://www.cnn.com/2021/01/19/uk/rxg-anzac-day-parole-release-intl-hnk/index.html,2021-01-19 09:20:28.000 Z
d8f580c9f6428d52bb5da5dd3f8c9c5c8ca89a24,India achieves stunning Test victory over Australia with record-breaking run chase,https://www.cnn.com/2021/01/19/sport/india-australia-test-cricket-spt-intl/index.html,2021-01-19 14:46:08.000 Z
6fe7bc073f79cb3f8e24d7203057ba2cccb33776,Pentagon chief says 'no intelligence indicating an insider threat' to inauguration as FBI vets National Guard,https://www.cnn.com/2021/01/18/politics/fbi-vetting-national-guard/index.html,2021-01-19 11:26:17.000 Z
c1505207c7353d0b938ffa4c80b1cadd4ef5c1c7,Trump's Pentagon chief says he 'cannot wait to leave' his job,https://www.cnn.com/2021/01/15/politics/christopher-miller-leave-pentagon/index.html,2021-01-15 22:39:56.000 Z
4ba6e4cbd439937d00a86bad4a164e24cbf5074e,Walmart CEO blames 'fiction' of fraudulent election for dividing Americans,https://www.cnn.com/2021/01/19/investing/walmart-ceo-election-trump-biden/index.html,2021-01-19 18:39:38.000 Z
6856d5bc04bba3b2fe950585a158bc389237197c,IRS: Tax filing season will start February 12,https://www.cnn.com/2021/01/15/success/irs-federal-tax-filing-season-starting-date-feseries/index.html,2021-01-15 18:56:42.000 Z
e19a85d350dccd119457ed3a53741e6843dc7498,Liverpool's shock defeat to Burnley ends 68-game unbeaten run at Anfield,https://www.cnn.com/2021/01/22/football/liverpool-loses-undefeated-anfield-record-burnley-spt-intl/index.html,2021-01-22 10:03:54.000 Z
489e2d8f8be3cade76a6bcf912d30915915c2bdf,Netflix crosses 200 million subscribers milestone,https://www.cnn.com/2021/01/19/media/netflix-earnings/index.html,2021-01-20 02:41:36.000 Z
410bb35634a8a5fd650253088b864e4fb0ea7569,"Biden's work just got harder: America lost a staggering 140,000 jobs in December",https://www.cnn.com/2021/01/08/economy/december-2020-jobs-report/index.html,2021-01-08 15:43:27.000 Z
a954059312d110c5216cdfa25660df76f3038a1b,The sordid truth behind Degas' ballet dancers,https://www.cnn.com/style/article/edgar-degas-ballet-dancers-artsy/index.html,2021-01-06 09:50:15.000 Z
8457d00f027fb35d941c7686e25fa3a72a85a3f8,Meet the woman tasked with turning around scandal-plagued Bon Appétit,https://www.cnn.com/2020/11/30/media/bon-appetit-eic-dawn-davis-risk-takers/index.html,2020-11-30 17:04:23.000 Z
c56d206c4f4a6fda5ab9373b4cb0468f91969b44,Sen. Josh Hawley finds new publisher after Simon & Schuster dropped book,https://www.cnn.com/2021/01/18/politics/josh-hawley-book-regnery-simon--schuster/index.html,2021-01-18 22:13:08.000 Z
a6d5d5bbed744e0b2e1b7ab08e428ab9142dae85,Miami's Little Haiti wasn't a target for developers. Until the seas started to rise.,https://www.cnn.com/2019/07/11/us/miami-little-haiti-climate-gentrification-weir-wxc/index.html,2019-07-12 15:14:00.000 Z
cf51ce3316836958231ccf20ac874aa569ef2e96,"Can America still promote democracy? Yes, and it should start with Ukraine",https://www.cnn.com/2021/01/13/opinions/can-america-still-promote-democracy-ukraine-bociurkiw/index.html,2021-01-13 18:22:39.000 Z
5bbae43e26860c05ae357775196072024da37845,German foreign minister: anti-Semitism keeps shape-shifting. This is what we are doing to stop it,https://www.cnn.com/2021/01/23/opinions/fighting-against-holocaust-distortion-heiko-maas/index.html,2021-01-23 05:00:57.000 Z
78745b0c4e1711f172540a86de037e5556e0ed55,Biden names acting agency heads as key Cabinet nominees remain unconfirmed,https://www.cnn.com/2021/01/20/politics/biden-acting-agency-heads/index.html,2021-01-21 01:17:32.000 Z
1daeeabf17d7e96844edcc10fd7ca05701ed37aa,Investigative report offers up-close look at Jacob Blake shooting in Wisconsin,https://www.cnn.com/2021/01/11/us/jacob-blake-kenosha-shooting-events/index.html,2021-01-11 12:25:33.000 Z
e288e5c2a70767b41572f88437d7eaaf7427531a,How a lone Capitol Police officer lured rioters away from the Senate chambers,https://www.cnn.com/2021/01/12/us/capitol-police-eugene-goodman-riots-senate-chambers-trnd/index.html,2021-01-12 13:53:26.000 Z
64ec8d343f364f086eae170e7c05d03823d00a99,Trump wants Sessions to investigate New York Times op-ed,https://www.cnn.com/2018/09/07/politics/donald-trump-jeff-sessions-investigation/index.html,2018-09-08 12:28:53.000 Z
46df1e013570eb45d1e7bc0b0a05506fbfc5e056,Moschino sends puppets down the runway for Milan Fashion Week,https://www.cnn.com/style/article/moschino-milan-fashion-week-puppets-spring-summer-2021/index.html,2020-09-30 15:22:03.000 Z
4ab4c5a0b6e433eb826f6efb415657a7beda99b8,Remember when Dolly Parton fully subverted the 'dumb blonde' cliché with her '80s excess styling?,https://www.cnn.com/style/article/remember-when-dolly-parton/index.html,2020-08-05 13:20:03.000 Z
1c941a01e0e79fd155527a376d7f9e484714e4b5,Early humans adapted to major environmental change in 'Cradle of Mankind' 2 million years ago,https://www.cnn.com/2021/01/08/world/early-humans-environment-adaptation-scn/index.html,2021-01-08 11:33:04.000 Z
c504e9932380060699f83a307849b246fdf0f39d,Marvel's 'WandaVision' looks to make Disney+ even mightier,https://www.cnn.com/2021/01/15/media/wandavision-marvel-disney/index.html,2021-01-15 12:32:50.000 Z
ce4acdff648e0c62ee37ddaa2a13168d8ecac5ef,EU and US call for probe into Uganda election violence as Bobi Wine remains under house arrest,https://www.cnn.com/2021/01/21/africa/uganda-elections-international-pressure-intl/index.html,2021-01-21 11:30:39.000 Z
50257c5b067a24271ce9f8670b4e467f45443834,Twitter temporarily suspends Rep. Marjorie Taylor Greene for election misinformation,https://www.cnn.com/2021/01/17/politics/marjorie-taylor-greene-twitter/index.html,2021-01-18 02:01:48.000 Z
dbe2bd8ac95e746b05dbba87239bb56de6baddc2,Spectacular city carved from snow and ice rises in China,https://www.cnn.com/travel/article/harbin-snow-ice-festival-events-canceled-intl-hnk/index.html,2021-01-11 04:03:14.000 Z
7af983f34802761df77c565bc7a0eedc466a66e1,Jill Biden announces more key staff for East Wing,https://www.cnn.com/2021/01/14/politics/jill-biden-east-wing-announcements/index.html,2021-01-14 18:56:04.000 Z
60c40e4bd9d8fb8b8527f9db2bb23fc3bfc87037,"For many parents, the swearing-in of Kamala Harris was an inspirational teaching moment for their kids",https://www.cnn.com/2021/01/21/us/children-watch-kamala-harris-oath-trnd/index.html,2021-01-21 06:01:37.000 Z
68edff0e8042a72606e7df9ca3780b9e592229f0,Trump signs executive order that critics warn politicizes federal career civil service,https://www.cnn.com/2020/10/23/politics/trump-executive-order-federal-employees/index.html,2020-10-23 15:16:48.000 Z
dfc340ed6511163ce4a27f0b13fa9f5c12f1ca21,Trump leaves America at its most divided since the Civil War,https://www.cnn.com/2021/01/19/politics/trump-divided-america-civil-war/index.html,2021-01-19 12:38:31.000 Z
a1912779283e3a91627216bf8856db933ddda009,Billionaire GOP donor says he feels 'betrayed' by Trump and vows to support Biden,https://www.cnn.com/2021/01/13/business/ken-langone-trump-betrayal/index.html,2021-01-14 20:03:47.000 Z
131aca1d841142dc28291937acb37428677bc402,"'Batwoman' gets a new lead, but Season 2 looks like the same flawed show",https://www.cnn.com/2021/01/16/entertainment/batwoman-season-2-review/index.html,2021-01-16 15:49:09.000 Z
8e1718f158a66bb469fd4e6e45a26707f663e14b,Uganda's lesson to other authoritarians: controlling the internet works,https://www.cnn.com/2021/01/18/africa/uganda-election-internet-intl-hnk/index.html,2021-01-18 07:56:31.000 Z
310c2f79f973d8267f2584b54a5d3ce21c7598b9,"Three-quarters of Wuhan patients hospitalized for Covid-19 still had symptoms 6 months later, Chinese study finds",https://www.cnn.com/2021/01/11/asia/china-wuhan-covid-consequence-intl-hnk/index.html,2021-01-13 00:57:00.000 Z
7b4c23db988f73c32ad57f9fa6815c17509cba64,"Ford will recall 3 million vehicles for airbag problems, after losing fight with safety regulator",https://www.cnn.com/2021/01/22/business/ford-takata-airbag-recall/index.html,2021-01-22 19:04:55.000 Z
c5c8769f6a9c2aecba19d04f2fb1f99fc3062476,Steph Curry ends Lakers' winning streak with impressive performance for Golden State Warriors,https://www.cnn.com/2021/01/19/sport/steph-curry-la-lakers-golden-state-warriors-nba-spt-intl/index.html,2021-01-19 10:52:55.000 Z
52c0f9d6b45fbd4f5aba936ef690fcb5432a7b4a,"He was skeptical of Covid-19. Now, from his hospital bed, he posts videos on social media urging others to wear their masks",https://www.cnn.com/2021/01/05/us/covid-skeptic-hospital-plea-trnd/index.html,2021-01-06 02:35:09.000 Z
47d30dc4500357e2e76163e1746ad83006124538,"Risk of ADHD may increase if expectant mother has autoimmune disorder, study says",https://www.cnn.com/2021/01/19/health/adhd-kids-mother-autoimmune-disease-study-wellness/index.html,2021-01-19 16:00:28.000 Z
50f300f0d699acc51df0ec35abb52d58f3341273,Trump administration strikes parting blow at Medicaid with Tennessee block grant,https://www.cnn.com/2021/01/08/politics/trump-administration-medicaid-block-grant-tennessee/index.html,2021-01-09 00:08:28.000 Z
4a65c8e0d4f5b9b5cb8f0f9adea222f59b797a5f,Tampa Bay quarterback Tom Brady releases a hype video ahead of the NFC Championship game,https://www.cnn.com/2021/01/24/us/tom-brady-hype-video-nfc-championship-trnd/index.html,2021-01-24 20:26:27.000 Z
4ee32c766ac34b894e97bee82bf2d7a07389eef7,Ghana president warns of health system overload as Covid cases soar,https://www.cnn.com/2021/01/18/africa/ghana-covid-cases-soar-intl/index.html,2021-01-18 14:02:51.000 Z
459792ae0f98c358a9b4f4ce23e0dc76831a5e67,Cristiano Ronaldo's 760th goal fuels debate over greatest goalscorer of all time,https://www.cnn.com/2021/01/21/football/cristiano-ronaldo-breaks-all-time-goal-record-spt-intl/index.html,2021-01-21 15:17:10.000 Z
ca4cd83c1de636e3aba1bbb50f4cbc3c236f8a89,'Locked Down' turns quarantine into a romantic heist movie for the Covid time capsule,https://www.cnn.com/2021/01/13/entertainment/locked-down-review/index.html,2021-01-13 21:45:54.000 Z
194a296ca28118308283f4945c41e5fd444d8415,The world's safest airlines for 2021 revealed,https://www.cnn.com/travel/article/worlds-safest-airlines-2021/index.html,2021-01-07 09:34:40.000 Z
ce02069b0ebc0e64b7c299c57490239f976e3b46,From rainbow to gray: The evolution of hair dye,https://www.cnn.com/style/article/hair-dye-evolution/index.html,2020-03-25 12:41:46.000 Z
724e8f70f5e6a52ca7ecb962b84cfc0e0891bd7a,These Black voters in Georgia say they're hopeful for the future after seeing their state vote blue,https://www.cnn.com/2021/01/19/us/georgia-black-voters-future/index.html,2021-01-19 17:45:49.000 Z
78ccccf7b43d73de4fae43ba8cbe0713fba3b8e5,A four-year timeline of Donald Trump and the Supreme Court,https://www.cnn.com/2021/01/19/politics/supreme-court-trump-timeline/index.html,2021-01-19 14:39:01.000 Z
9ac900317b84e2093803caafa5b01d9151736184,What Hoover could teach Trump about Inauguration Day,https://www.cnn.com/2021/01/19/opinions/herbert-hoover-inauguration-day-lesson-jacobs/index.html,2021-01-20 00:06:10.000 Z
febd6245b87cd9efb48684b65b3232f11b85116c,Metal detectors installed outside House floor as Democrats express safety concerns about their colleagues,https://www.cnn.com/2021/01/12/politics/house-democrats-safety-worries/index.html,2021-01-13 01:17:50.000 Z
d62fdc74174d808d92f474e5bcd4bb68f8c2fa9c,David Axelrod: The scary call I got the night before Barack Obama's inauguration,https://www.cnn.com/2021/01/18/opinions/barack-obama-inauguration-scary-call-axelrod/index.html,2021-01-18 20:12:16.000 Z
d4d91fee33863c4ee1ad15e3d9f05023b632126c,CDC still working on goal to double coronavirus sequences to expand hunt for mutations,https://www.cnn.com/2021/01/22/health/genetic-sequencing-cdc/index.html,2021-01-22 11:47:01.000 Z
3e564ebf89ee5cbd3705bf127c25ec501038528c,The biggest loser in the Georgia runoffs,https://www.cnn.com/2021/01/06/opinions/biggest-loser-georgia-senate-runoffs-mcintosh/index.html,2021-01-07 09:20:55.000 Z
84af5fa8654f5c631c96540eb4ec73f11f6495ee,"If Kim Jong Un destroyed North Korea's economy to keep Covid-19 out, will sanctions stop him from pursuing nuclear weapons?",https://www.cnn.com/2021/01/18/asia/north-korea-covid-sanctions-dst-intl-hnk/index.html,2021-01-19 03:31:31.000 Z
27da0523f4753b4d322c2ce5b33a1852644296d7,The polar vortex may be on its way,https://www.cnn.com/2021/01/07/weather/polar-vortex-shifts-arctic-air-south/index.html,2021-01-08 00:29:21.000 Z
1a51fa4d885b1d0d569fe4413796625fd12d2585,Pompeo says more rights don't mean more justice as he unveils human rights report,https://www.cnn.com/2020/07/16/politics/commission-on-unalienable-rights-report-unveiled/index.html,2020-07-16 22:55:42.000 Z
f8421ddca6e6f81140b22801b4373eaa13ec81a5,Kelly Loeffler's disastrous Senate term,https://www.cnn.com/2021/01/06/politics/kelly-loeffler-senate-term-analysis/index.html,2021-01-06 16:00:47.000 Z
263ab5fc9ee8f0483d3650dacc013d4919e86946,"Welcome to our reality, white America",https://www.cnn.com/2020/06/03/politics/racial-inequality-george-floyd-protest-white-america/index.html,2020-06-03 23:00:53.000 Z
eae5a0383d76c7790704920b2638cb6eb77fa8ad,China is hitting back at criticism of its vaccines with a dangerous disinformation campaign,https://www.cnn.com/2021/01/19/china/china-vaccine-disinformation-intl-hnk/index.html,2021-01-19 08:51:43.000 Z
f559224b04bc368bc4a4d40b07e1c83b473850fb,Lil Wayne pleads guilty to federal firearm charge,https://www.cnn.com/2020/12/11/entertainment/lil-wayne-gun-charge-guilty-plea/index.html,2020-12-12 00:12:35.000 Z
7c3c7d84275bf16786d1cdc92e5ec73ef5db6277,Dr. Sanjay Gupta: Memory fades as we age. But it doesn't have to,https://www.cnn.com/2021/01/05/health/sanjay-gupta-brain-health-keep-sharp-wellness/index.html,2021-01-09 00:37:25.000 Z
91b7f4639c42df8093dbcd4bc2c81fbaffd24705,How Trump allies stoked the flames ahead of Capitol riot,https://www.cnn.com/2021/01/18/politics/trump-bannon-stone-giuliani-capitol-riot-invs/index.html,2021-01-19 02:33:24.000 Z
